,Course Title,Course Headline,Rating,Reviews,Course Length,Lectures,Level,Instructor
337,How to learn programming and become a programmer,"A <strong>programming</strong> course for total beginners that will set you on your path to learn Python, Java, C#, PHP and JavaScript.",Rating: 4.1 out of 5,99 reviews,4 total hours,55 lectures,Beginner,Liviu Oprisan
338,Short Programming intro in Python and C++,Enough basics to decide your next deep course!,Rating: 4.4 out of 5,277 reviews,9 total hours,116 lectures,Beginner,"Dr. Moustafa Saad Ibrahim, CSGetSkilled Academy"
339,Windows Programming for Everyone,"The Perfect <strong>Programming</strong> Language for Beginners and Experts,  Rexx is easy to Learn and Powerful to Use",Rating: 4.3 out of 5,169 reviews,5.5 total hours,27 lectures,All Levels,Bill Swartz
340,Learn Programming with Python,Learn the fundamental <strong>programming</strong> concepts with Python. This course is for beginners to intermediate level.,Rating: 4.1 out of 5,204 reviews,8.5 total hours,27 lectures,Beginner,Vinay Kumar
341,Python Programming Fundamentals,Learn Key <strong>Programming</strong> Skills,Rating: 4.4 out of 5,23 reviews,2 total hours,21 lectures,Beginner,Bluelime Learning Solutions
342,C Programming 360° Bootcamp: Zero to Hero,,Rating: 4.8 out of 5,42 reviews,13.5 total hours,118 lectures,All Levels,Electrovert Labs
343,C Programming Language Hands-On-Lab Challenge,,Rating: 0.0 out of 5,0 reviews,22.5 total hours,140 lectures,All Levels,Atish Jain
344,Programming Practices for Software Engineers,,Rating: 0.0 out of 5,0 reviews,7 total hours,84 lectures,All Levels,RougeNeuron Academy
345,8086 Microprocessor - Architecture & Programming,,Rating: 5.0 out of 5,2 reviews,19 total hours,40 lectures,Intermediate,Dr. Yogesh Misra
346,The Guide to Computer Programming in Java,,Rating: 4.9 out of 5,4 reviews,7 total hours,48 lectures,All Levels,Alexandru Dincă
347,Programming with Python - part1,,Rating: 0.0 out of 5,0 reviews,4.5 total hours,17 lectures,Beginner,Alison A
348,Go Programming Bootcamp,,Rating: 4.8 out of 5,80 reviews,15.5 total hours,81 lectures,All Levels,Derek Banas
349,C# Tutorial: Full Course For Beginners - Fundamentals of C#,,Rating: 0.0 out of 5,0 reviews,26.5 total hours,16 lectures,Beginner,Furkan Gözükara
350,Understanding Computer Programming Concepts For Beginners,"Absolute beginners guide to understand basic concepts of computer <strong>programming</strong> from scratch in C, C++, C#, Python & Java",Rating: 3.2 out of 5,36 reviews,1.5 total hours,17 lectures,All Levels,"Emenwa Global, Zoolord Academy"
351,Learn Computer Programming from Absolute Zero,"<strong>Programming</strong> fundamentals: Learn how to program computers, clear and easy, with no prerequisites!",Rating: 4.4 out of 5,27 reviews,3.5 total hours,86 lectures,Beginner,Alex Deva
352,SQL- The Complete Introduction to SQL programming,Learn the basics of SQL <strong>programming</strong> and Data manipulation with the use SQL,Rating: 4.1 out of 5,2433 reviews,3.5 total hours,26 lectures,Beginner,Yassin Marco
353,Batch Script Programming Crash Course (CMD),Learn Batch Script <strong>Programming</strong> From Beginning To Advance With Batch File/Script Crash Course - Zero To Hero,Rating: 4.4 out of 5,261 reviews,1.5 total hours,35 lectures,All Levels,Narendra Dwivedi
354,Programming Fundamentals For Beginners,Learn important <strong>programming</strong> concepts,Rating: 4.0 out of 5,17 reviews,2 total hours,18 lectures,Beginner,Bluelime Learning Solutions
355,Object Oriented Programming for beginners - Using Python,Learn and understand object oriented <strong>programming</strong> step by step,Rating: 4.4 out of 5,558 reviews,3 total hours,28 lectures,Beginner,Bluelime Learning Solutions
356,The In-depth C Programming Course: From Beginner to Advanced,Take yourself from beginner to expert using C <strong>programming</strong> learn tricky concepts and solve advanced <strong>programming</strong> problems!,Rating: 4.4 out of 5,72 reviews,7.5 total hours,46 lectures,All Levels,Esther O. Peters
357,Learn Socket Programming in C from Scratch,Master the socket <strong>programming</strong> concepts and start building networked applications in C <strong>programming</strong> language,Rating: 4.0 out of 5,2367 reviews,1.5 total hours,11 lectures,Intermediate,"Eduonix Learning Solutions, Eduonix-Tech ., Eduonix Support"
358,TCP/IP Socket Programming Windows Linux Interview - C&C++,Scratch to Master - TCP/UDP Protocol Client/Server Socket Program-OSI Networking Concept Bootcamp Course with Execution,Rating: 3.8 out of 5,274 reviews,9 total hours,21 lectures,Intermediate,Sonali Shrivastava
359,C# programming step by step - from Beginner to Advanced,The easy way to learn C# Step by Step in the shortest possible time.,Rating: 4.3 out of 5,178 reviews,7 total hours,85 lectures,Beginner,Patrick Videos
360,Head Start to Computer Programming,"Learn fundamentals of <strong>Programming</strong>, its terms, techniques and core concepts prior to learning a <strong>programming</strong> language",Rating: 4.0 out of 5,14 reviews,3.5 total hours,23 lectures,Beginner,eLearnGenie .
361,Break Into The Programming Business,The world of <strong>programming</strong> for entrepreneurs and startups,Rating: 3.6 out of 5,67 reviews,3 total hours,19 lectures,All Levels,Huw Collingbourne
362,From 0 to 1: C Programming - Drill Deep,C <strong>Programming</strong> is still a very useful skill to have - and this is the course to pick it up!,Rating: 4.5 out of 5,246 reviews,12 total hours,60 lectures,All Levels,Loony Corn
363,Object Oriented Programming - Timeless Principles,"Object Oriented <strong>Programming</strong>, master it!",Rating: 4.3 out of 5,306 reviews,1 total hour,13 lectures,Beginner,Grant Klimaytys
364,Object Oriented Programming - Timeless Principles,"Object Oriented <strong>Programming</strong>, master it!",Rating: 4.3 out of 5,306 reviews,1 total hour,13 lectures,Beginner,Grant Klimaytys
365,Programming For Non-Programmers: Fundamentals,"Learn how to speak with developers. Designed for entrepreneurs, businesses, and junior developers.",Rating: 3.9 out of 5,501 reviews,3.5 total hours,31 lectures,All Levels,Christopher Michael
366,Big Data Programming Languages & Big Data Vs Data Science,"Big Data <strong>Programming</strong> Languages,Skills to become a Big Data Professional,Differences between Big Data &  Data Science",Rating: 3.8 out of 5,275 reviews,36 total mins,6 lectures,Beginner,Lalitha Audikesavan
367,"C programming, Golden step to become software developer",The C <strong>programming</strong> language is one of the foundation or base-language of many <strong>programming</strong> languages today.,Rating: 4.4 out of 5,18 reviews,5.5 total hours,79 lectures,Beginner,"Chaand Sheikh, Easy2Byte by StudyEasy"
368,Object Oriented Programming in Javascript - Complete Course,"Learn Object Oriented <strong>programming</strong> in Javascript (Prototypes, classes, modules) - ton of hands-on examples and exercises",Rating: 3.7 out of 5,118 reviews,7.5 total hours,48 lectures,All Levels,DigiFisk (Programming is fun)
369,The Essential Kotlin Programming Course (Android Developers),A deep dive exploring the Kotlin <strong>Programming</strong> Language,Rating: 4.4 out of 5,544 reviews,23 total hours,133 lectures,All Levels,Jason Fedin
370,C Programming 360° Bootcamp: Zero to Hero,,Rating: 4.8 out of 5,42 reviews,13.5 total hours,118 lectures,All Levels,Electrovert Labs
371,C Programming Language Hands-On-Lab Challenge,,Rating: 0.0 out of 5,0 reviews,22.5 total hours,140 lectures,All Levels,Atish Jain
372,Programming Practices for Software Engineers,,Rating: 0.0 out of 5,0 reviews,7 total hours,84 lectures,All Levels,RougeNeuron Academy
373,8086 Microprocessor - Architecture & Programming,,Rating: 5.0 out of 5,2 reviews,19 total hours,40 lectures,Intermediate,Dr. Yogesh Misra
374,The Guide to Computer Programming in Java,,Rating: 4.9 out of 5,4 reviews,7 total hours,48 lectures,All Levels,Alexandru Dincă
375,Programming with Python - part1,,Rating: 0.0 out of 5,0 reviews,4.5 total hours,17 lectures,Beginner,Alison A
376,Go Programming Bootcamp,,Rating: 4.8 out of 5,80 reviews,15.5 total hours,81 lectures,All Levels,Derek Banas
377,C# Tutorial: Full Course For Beginners - Fundamentals of C#,,Rating: 0.0 out of 5,0 reviews,26.5 total hours,16 lectures,Beginner,Furkan Gözükara
378,Advanced Python Programming,Learn advanced Python <strong>programming</strong> techniques and methods,Rating: 4.2 out of 5,35 reviews,1.5 total hours,24 lectures,Intermediate,Programming Tut
379,Scala Programming In-Depth,Scala <strong>Programming</strong> From Scratch To Depth,Rating: 4.3 out of 5,444 reviews,39.5 total hours,27 lectures,Expert,Harish Masand
380,C Programming - Foundations,Learn C <strong>Programming</strong> and increase your career options. Become a master of the C <strong>programming</strong> language foundations.,Rating: 4.3 out of 5,15 reviews,11.5 total hours,57 lectures,Beginner,Panagiotis Gnafakis
381,C++ Programming Basics to Advance with Live Projects,"C++ Basic to Advance <strong>Programming</strong> with OOPS concept, Projects, Object Oriented <strong>Programming</strong> Language, Tutorial for CSE",Rating: 3.7 out of 5,12 reviews,11 total hours,80 lectures,All Levels,Jaspreet Kaur
382,The Complete C Programming Tutorial,Learn complete C <strong>Programming</strong> basic fundamentals  with example codes explained in details,Rating: 4.4 out of 5,1607 reviews,4.5 total hours,57 lectures,Beginner,DoEdu IT Educations
383,"16 beginner programming projects: Java, Python,JavaScript,c#",Learn to program in multiple <strong>programming</strong> languages with step by step projects,Rating: 3.9 out of 5,77 reviews,17 total hours,164 lectures,Beginner,Bluelime Learning Solutions
384,Full Introduction to Programming Course,A Beginner's Guide to <strong>Programming</strong> Concepts,Rating: 4.1 out of 5,25 reviews,6.5 total hours,77 lectures,All Levels,Ricky Wahowa
385,A Complete Introduction to the C++ Programming Language,Learn the C++ <strong>programming</strong> language with a step-by-step introduction of all the important concepts and language features.,Rating: 4.4 out of 5,156 reviews,3 total hours,67 lectures,All Levels,Dmitri Nesteruk
386,"The Road To Dynamic Programming: Java, JavaScript, & Python","Recursion, Memoization, and Tabulation in Dynamic <strong>Programming</strong>",Rating: 4.3 out of 5,216 reviews,5.5 total hours,42 lectures,All Levels,Hadi youness
387,"C, C++, Python and Ruby Programming","C, C++, Python and Ruby python <strong>programming</strong> Courses with Practical Examples",Rating: 3.9 out of 5,522 reviews,25.5 total hours,307 lectures,All Levels,DoEdu IT Educations
388,JavaScript Programming Fundamentals,Learn <strong>Programming</strong> Skills Using JavaScript,Rating: 3.8 out of 5,15 reviews,2 total hours,22 lectures,Beginner,Bluelime Learning Solutions
389,C++ Programming Bootcamp - Learn Complete C++  From 0 to 100,Start Your Coding Journey by Learning C++ <strong>Programming</strong> Language  From  Basic To Advance Level,Rating: 4.5 out of 5,30 reviews,9 total hours,105 lectures,All Levels,Piroz Amin
390,Mastering the concept of Pointers - C++ Programming,"Pointers ,Pointers arithmetic, Character Pointers, Double Pointers, Dynamic Memory Allocations",Rating: 4.4 out of 5,19 reviews,3.5 total hours,13 lectures,All Levels,Kunal Gupta
391,Professional C++ 17- Object-Oriented C++ Programming Course,"Beyond the Basics - Learn C++ <strong>Programming</strong> with Hands-On and Expert Instruction, Design Principles and Patterns",Rating: 4.4 out of 5,21 reviews,6 total hours,44 lectures,Intermediate,Chuck McCullough
392,कीजिये तैयारी Programming & Coding Interviews की,"A course that teaches pointers, linked lists, general <strong>programming</strong>, algorithms and recursion like no one else",Rating: 4.6 out of 5,44 reviews,20.5 total hours,82 lectures,All Levels,Loony Corn
393,Object Oriented Programming : The Foundation of OOP,learn Object Oriented <strong>Programming</strong> aka OOP using a hands on approach,Rating: 3.4 out of 5,16 reviews,3 total hours,29 lectures,Beginner,University of Geeks
394,C PROGRAMMING,Learn C <strong>Programming</strong> Language Basic to Advance,Rating: 3.8 out of 5,93 reviews,2.5 total hours,39 lectures,All Levels,DIGIFLAX E-LEARNING
395,C Programming For Beginners - with 60 BONUS Simple Programs!,"Learn the C <strong>Programming</strong> language FAST - onscreen step by step, then IDE, then debugger. Designed for TECHNICAL INTERVIEW",Rating: 4.3 out of 5,307 reviews,12 total hours,117 lectures,All Levels,LearnGood Academy
396,Ruby Programming For Everyone,Learn Ruby <strong>Programming</strong> Fast!,Rating: 4.4 out of 5,653 reviews,2 total hours,30 lectures,Beginner,John Elder
397,C Programming for Beginners ,Go from having zero experience in <strong>programming</strong>  to being an expert programmer in this course!  *NO EXPERIENCE NECESSARY*,Rating: 4.3 out of 5,10 reviews,1 total hour,27 lectures,Beginner,A. O
398,C Programming 360° Bootcamp: Zero to Hero,,Rating: 4.8 out of 5,42 reviews,13.5 total hours,118 lectures,All Levels,Electrovert Labs
399,C Programming Language Hands-On-Lab Challenge,,Rating: 0.0 out of 5,0 reviews,22.5 total hours,140 lectures,All Levels,Atish Jain
400,Programming Practices for Software Engineers,,Rating: 0.0 out of 5,0 reviews,7 total hours,84 lectures,All Levels,RougeNeuron Academy
401,8086 Microprocessor - Architecture & Programming,,Rating: 5.0 out of 5,2 reviews,19 total hours,40 lectures,Intermediate,Dr. Yogesh Misra
402,The Guide to Computer Programming in Java,,Rating: 4.9 out of 5,4 reviews,7 total hours,48 lectures,All Levels,Alexandru Dincă
403,Programming with Python - part1,,Rating: 0.0 out of 5,0 reviews,4.5 total hours,17 lectures,Beginner,Alison A
404,Go Programming Bootcamp,,Rating: 4.8 out of 5,80 reviews,15.5 total hours,81 lectures,All Levels,Derek Banas
405,C# Tutorial: Full Course For Beginners - Fundamentals of C#,,Rating: 0.0 out of 5,0 reviews,26.5 total hours,16 lectures,Beginner,Furkan Gözükara
406,Basic Java Programming with NetBeans,Take the first step into the world of <strong>programming</strong>!,Rating: 4.2 out of 5,77 reviews,1 total hour,16 lectures,Beginner,Programming Tut
407,C Language Programming : Complete Guide on C,Ultimate Coarse on C <strong>Programming</strong>: Code like an expert by learning basics of C Language parogramming,Rating: 4.3 out of 5,45 reviews,8 total hours,23 lectures,Beginner,Anchal Kamra
408,Complete C++ Programming with Data Structures and Algorithms,"C++ <strong>Programming</strong> basics to Arrays, Strings, Pointers, Recursion, OOP's, Linked Lists, Stacks, Queues, Trees, Graphs ,DP",Rating: 4.1 out of 5,66 reviews,56.5 total hours,241 lectures,All Levels,Kunal Gupta
409,Fundamentals of  C++ |  Learn C++ Programming,If you’re ready to buckle down and learn C++ <strong>Programming</strong>  here’s where you should start.,Rating: 4.3 out of 5,19 reviews,11 total hours,34 lectures,Beginner,Programming Knowledge
410,All in One Practice Test for Programming Fundamentals,Ultimate way to check knowledge in fundamentals (basics) of <strong>programming</strong> - Consists of 240 questions,Rating: 4.4 out of 5,13 reviews,240 questions,,All Levels,Nitish Gupta
411,"C, C++, Java; A Programming MegaPrimer for Beginners","A perfect course for beginners to learn C, C++ and Java in Mobile optimized course",Rating: 4.0 out of 5,92 reviews,12.5 total hours,152 lectures,All Levels,Igneus Technologies
412,Computer programming for beginners: Understand how it works,No previous experience required! Learn the basic principles that will ease your further development as a programmer.,Rating: 3.8 out of 5,30 reviews,4 total hours,21 lectures,Beginner,Programming Simple Steps
413,[Free Java] Java Programming for Complete Beginners (OOP).,Java <strong>Programming</strong> Course Dedicated for Beginners. 2 Hours Videos and Code.,Rating: 4.1 out of 5,84 reviews,2.5 total hours,39 lectures,Beginner,Jack Danyan
414,Mastering iPhone Programming,"Complete guide to learn iOS7 iphone <strong>Programming</strong> with Objective C and Xcode, Cocoa and MVC, Sqlite, OpenGL ES and more.",Rating: 4.4 out of 5,26 reviews,14.5 total hours,58 lectures,All Levels,EDUmobile Academy
415,Programming for Beginners - Build games using Scratch,No Experiance In <strong>Programming</strong> Needed! - Build your own Flappy Birds game and learn to program games in Scratch,Rating: 4.2 out of 5,39 reviews,3 total hours,40 lectures,Beginner,Craig Blewett
416,Advanced Java Programming with Eclipse,Learn the Sought After Java Skills you Need for a <strong>Programming</strong> Career,Rating: 4.2 out of 5,22 reviews,3.5 total hours,52 lectures,Intermediate,Programming Tut
417,Must Know Object Oriented Programming in Java,An intensive <strong>programming</strong> for beginners course with the key topcis that every software devloper MUST know.,Rating: 4.4 out of 5,13 reviews,11.5 total hours,128 lectures,Beginner,"Mammoth Interactive, John Bura"
418,C++ Object Oriented Programming From Scratch,Learn The Biggest Invention of <strong>Programming</strong> World and Enhance your View To see The World Of softwares Differently,Rating: 4.2 out of 5,21 reviews,1 total hour,12 lectures,Intermediate,Lharrach Abdellah
419,Learn C programming from Scratch,A must learn <strong>programming</strong> language for beginners.,Rating: 3.7 out of 5,517 reviews,3.5 total hours,23 lectures,Beginner,Rajarshi Das
420,Introduction to Object Oriented Programming in C++,Learn the concepts of object oriented <strong>programming</strong> in C++ and its code implementation.,Rating: 4.2 out of 5,44 reviews,3 total hours,27 lectures,Beginner,Harshit Jain
421,"Beginning CUDA Programming: Zero to Hero, First Course!","Learn CUDA <strong>programming</strong> with GPGPU, kickstart your Big Data and Data Science Career!",Rating: 3.6 out of 5,186 reviews,2.5 total hours,33 lectures,Beginner,"Scientific Programmer™ Team, Scientific Programming School"
422,Eclipse | Your Basic Java Programming Course,Take your first step into the world of <strong>programming</strong> with this beginner course on Java. Become a programmer today!,Rating: 4.2 out of 5,92 reviews,1.5 total hours,16 lectures,Beginner,Programming Tut
423,Dlang: The Complete D programming Language Course (Next C++),"D Language: Learn basics to intermediate and OOP (Dlang has C, C++, C#, Java & Python features and Impacted Go & Swift)",Rating: 3.6 out of 5,20 reviews,5 total hours,52 lectures,Beginner,Nikoloz Sanakoevi
424,Linux System Programming using C and C++(Practical Approach),"Practical approach to Linux c-system <strong>programming</strong> for fork, thread, semaphore IPC, etc",Rating: 3.8 out of 5,497 reviews,6 total hours,33 lectures,All Levels,Shakil khan
425,C++ Object-Oriented Programming for Beginners,"Learn C++ Object-Oriented <strong>Programming</strong>, Classes, Objects, Inheritance, Polymorphism, Methods, Control Structures.",Rating: 3.4 out of 5,19 reviews,1 total hour,21 lectures,All Levels,A. O
426,C Programming 360° Bootcamp: Zero to Hero,,Rating: 4.8 out of 5,42 reviews,13.5 total hours,118 lectures,All Levels,Electrovert Labs
427,C Programming Language Hands-On-Lab Challenge,,Rating: 0.0 out of 5,0 reviews,22.5 total hours,140 lectures,All Levels,Atish Jain
428,Programming Practices for Software Engineers,,Rating: 0.0 out of 5,0 reviews,7 total hours,84 lectures,All Levels,RougeNeuron Academy
429,8086 Microprocessor - Architecture & Programming,,Rating: 5.0 out of 5,2 reviews,19 total hours,40 lectures,Intermediate,Dr. Yogesh Misra
430,The Guide to Computer Programming in Java,,Rating: 4.9 out of 5,4 reviews,7 total hours,48 lectures,All Levels,Alexandru Dincă
431,Programming with Python - part1,,Rating: 0.0 out of 5,0 reviews,4.5 total hours,17 lectures,Beginner,Alison A
432,Go Programming Bootcamp,,Rating: 4.8 out of 5,80 reviews,15.5 total hours,81 lectures,All Levels,Derek Banas
433,C# Tutorial: Full Course For Beginners - Fundamentals of C#,,Rating: 0.0 out of 5,0 reviews,26.5 total hours,16 lectures,Beginner,Furkan Gözükara
434,IntelliJ IDEA | Your Beginner Java Programming Course,Take your first step into the world of <strong>programming</strong> with this beginner course on Java. Become a programmer today!,Rating: 3.9 out of 5,21 reviews,1.5 total hours,16 lectures,Beginner,Programming Tut
435,Linux Socket Programming Hands On - Zero to Hero,"Topics covered :Local Sockets, Socket System calls,TCP Echo Server & Concurrent Server, UDP server, I/O Multiplexing etc",Rating: 4.1 out of 5,30 reviews,6 total hours,27 lectures,Beginner,Up Degree
436,Introduction To Python Programming,A Quick and Easy Intro into Python <strong>Programming</strong>,Rating: 4.4 out of 5,63142 reviews,1.5 total hours,18 lectures,Beginner,"Avinash Jain, The Codex"
437,Programming 101,"Comprehend basic foundational knowledge of hardware, networking, <strong>programming</strong> and licensing.",Rating: 4.5 out of 5,13683 reviews,4.5 total hours,35 lectures,All Levels,Lawrence Turton
438,Programming for Non-Programmers,It's fun <strong>programming</strong>.,Rating: 4.0 out of 5,203 reviews,2 total hours,34 lectures,Beginner,Coding Gears | Train Your Brain
439,Introduction to Programming,An introductory course that offers insights in <strong>Programming</strong> and Python,Rating: 4.7 out of 5,135 reviews,2 total hours,17 lectures,Beginner,Bharani Akella
440,Python OOP : Object Oriented Programming in Python,Python Object Oriented <strong>programming</strong> OOP advanced / Scripting for projects / automation / interview questions / beginners,Rating: 4.5 out of 5,1886 reviews,2.5 total hours,28 lectures,Beginner,Deepali Srivastava
441,Java Tutorial for Complete Beginners,Learn to program using the Java <strong>programming</strong> language,Rating: 4.4 out of 5,97405 reviews,16 total hours,73 lectures,All Levels,John Purcell
442,Python from Beginner to Intermediate in 30 min.,Complete Python <strong>Programming</strong> in 30 min - Get ready for Advanced Concepts.,Rating: 4.1 out of 5,9085 reviews,1.5 total hours,30 lectures,Beginner,Gautam Devaraj
443,R Basics - R Programming Language Introduction,Learn the essentials of R <strong>Programming</strong> - R Beginner Level!,Rating: 4.6 out of 5,17883 reviews,4 total hours,29 lectures,Beginner,R-Tutorials Training
444,Beginner Course on Programming and Coding Fundamentals,"A <strong>programming</strong> course for office workers, university students or anyone, who wants to learn the fundamentals of coding.",Rating: 4.6 out of 5,345 reviews,2 total hours,14 lectures,Beginner,Haris Samingan
445,C++ Tutorial for Complete Beginners,"How to program in the popular (and tricky!) C++ <strong>programming</strong> language, for complete beginners.",Rating: 4.5 out of 5,43289 reviews,18 total hours,82 lectures,Beginner,John Purcell
446,Python for Absolute Beginners!,Get started coding with one of the most beginner friendly <strong>programming</strong> languages!,Rating: 4.3 out of 5,5774 reviews,2.5 total hours,26 lectures,Beginner,"Joseph Delgadillo, Nick Germaine"
447,Master Object Oriented Programming Concepts,Object Oriented <strong>Programming</strong> Concepts with examples in Java,Rating: 4.4 out of 5,668 reviews,1.5 total hours,9 lectures,Intermediate,Sachin Pisal
448,Intro to Programming,Basics of <strong>programming</strong> for beginners,Rating: 3.9 out of 5,25 reviews,1 total hour,16 lectures,All Levels,Ricky Wahowa
449,Python Programming,Time to deep dive into Python <strong>Programming</strong>,Rating: 4.8 out of 5,60 reviews,2 total hours,25 lectures,Beginner,Pradeep Chelani
450,Java Programming for Beginners - Become a Java Developer,Learn Java <strong>programming</strong> and become a Java software developer in 6 months! What you will learn applies in Java 8-17,Rating: 4.3 out of 5,804 reviews,2 total hours,13 lectures,Beginner,Academia Programatorilor
451,Scratch Game Programming,A fun guide to <strong>programming</strong> for parents & teachers who want to help kids learn to code.,Rating: 4.6 out of 5,4778 reviews,6.5 total hours,32 lectures,Beginner,Al Sweigart
452,Java Programming Basics,Learn to program! Let's walk through some simple examples and I'll explain everything along the way.,Rating: 4.5 out of 5,9889 reviews,3 total hours,17 lectures,Beginner,Charles Mulic
453,Object Oriented Programming in C++  &  Interview Preparation,"Classroom like learning, Detailed Explanation of Question",Rating: 4.2 out of 5,1547 reviews,2 total hours,21 lectures,All Levels,Codaming - VeDinesh Academy
454,C Programming 360° Bootcamp: Zero to Hero,,Rating: 4.8 out of 5,42 reviews,13.5 total hours,118 lectures,All Levels,Electrovert Labs
455,C Programming Language Hands-On-Lab Challenge,,Rating: 0.0 out of 5,0 reviews,22.5 total hours,140 lectures,All Levels,Atish Jain
456,Programming Practices for Software Engineers,,Rating: 0.0 out of 5,0 reviews,7 total hours,84 lectures,All Levels,RougeNeuron Academy
457,8086 Microprocessor - Architecture & Programming,,Rating: 5.0 out of 5,2 reviews,19 total hours,40 lectures,Intermediate,Dr. Yogesh Misra
458,The Guide to Computer Programming in Java,,Rating: 4.9 out of 5,4 reviews,7 total hours,48 lectures,All Levels,Alexandru Dincă
459,Programming with Python - part1,,Rating: 0.0 out of 5,0 reviews,4.5 total hours,17 lectures,Beginner,Alison A
460,Go Programming Bootcamp,,Rating: 4.8 out of 5,80 reviews,15.5 total hours,81 lectures,All Levels,Derek Banas
461,C# Tutorial: Full Course For Beginners - Fundamentals of C#,,Rating: 0.0 out of 5,0 reviews,26.5 total hours,16 lectures,Beginner,Furkan Gözükara
