,Course Title,Course Headline,Rating,Reviews,Course Length,Lectures,Level,Instructor
694,Multithreading and Parallel Programming in C#,Overcome multithreading and asynchronous <strong>programming</strong> in C# problems & improve performance by parallel computing in C#,Rating: 4.0 out of 5,497 reviews,7 total hours,80 lectures,All Levels,Engineer Spock
695,Complete C++ programming from C++ Basics to Advanced C++,Learn C++ from C++ Basics to C++ OOP - C++ loops C++ arrays C++ inheritance C++ pointers C++ polymorphism C++ functions,Rating: 4.7 out of 5,482 reviews,2.5 total hours,46 lectures,All Levels,Muhammad Hamza AbdulRehman
696,Introduction to CNC Programming,Learn to program CNC Routers and CNC Milling machines that use the GCODE language.,Rating: 4.4 out of 5,1475 reviews,2 total hours,24 lectures,Beginner,Marc Cronin
697,Learn MATLAB and Simulink Programming,Master MATLAB <strong>Programming</strong> fundamentals and Simulink to increase your number crunching abilities.,Rating: 4.4 out of 5,1083 reviews,7 total hours,76 lectures,All Levels,Jordan Christman
698,Learn Python from Scratch : Python Programming,Build your Python Career as a Programmer and Data Science Analyst,Rating: 4.7 out of 5,38 reviews,8.5 total hours,62 lectures,All Levels,Metla Sudha Sekhar
699,C++ Programming - From Scratch to Advanced,Learn C++ from the basics to the advanced concepts.,Rating: 4.5 out of 5,385 reviews,8.5 total hours,75 lectures,All Levels,Sujithkumar MA
700,C++ Programming - From Scratch to Advanced,Learn C++ from the basics to the advanced concepts.,Rating: 4.5 out of 5,385 reviews,8.5 total hours,75 lectures,All Levels,Sujithkumar MA
701,Learn to code with Scratch Programming for Everybody,From kids to Adults learn to program using Scratch developed by MIT,Rating: 4.7 out of 5,88 reviews,10 total hours,69 lectures,Beginner,Andrew Schlegel
702,Complete Python Programming Fundamentals And Sample Projects,Learn Python! Master the fundamentals of Python & build your Python <strong>programming</strong> skill with sample projects in Python 3,Rating: 3.9 out of 5,136 reviews,7 total hours,66 lectures,All Levels,"Emenwa Global, Zoolord Academy"
703,The Ultimate Python Programming Tutorial ,Python <strong>Programming</strong> tutorial for beginners. This Python Training Course Comes with Certification of Completion,Rating: 4.2 out of 5,2011 reviews,6 total hours,94 lectures,All Levels,Infinite Skills
704,Advanced Java Programming,Take Your Java <strong>Programming</strong> Skills To The Next Level. Become Proficient In Java <strong>Programming</strong>,Rating: 4.4 out of 5,926 reviews,8 total hours,101 lectures,Intermediate,Infinite Skills
705,Java Swing (GUI) Programming: From Beginner to Expert,Learn how to create desktop and Internet GUI Java programs and take your Java <strong>programming</strong> to the next level.,Rating: 4.5 out of 5,2475 reviews,14 total hours,93 lectures,All Levels,John Purcell
706,C Programming 360° Bootcamp: Zero to Hero,,Rating: 4.8 out of 5,42 reviews,13.5 total hours,118 lectures,All Levels,Electrovert Labs
707,C Programming Language Hands-On-Lab Challenge,,Rating: 0.0 out of 5,0 reviews,22.5 total hours,140 lectures,All Levels,Atish Jain
708,Programming Practices for Software Engineers,,Rating: 0.0 out of 5,0 reviews,7 total hours,84 lectures,All Levels,RougeNeuron Academy
709,8086 Microprocessor - Architecture & Programming,,Rating: 5.0 out of 5,2 reviews,19 total hours,40 lectures,Intermediate,Dr. Yogesh Misra
710,The Guide to Computer Programming in Java,,Rating: 4.9 out of 5,4 reviews,7 total hours,48 lectures,All Levels,Alexandru Dincă
711,Programming with Python - part1,,Rating: 0.0 out of 5,0 reviews,4.5 total hours,17 lectures,Beginner,Alison A
712,Go Programming Bootcamp,,Rating: 4.8 out of 5,80 reviews,15.5 total hours,81 lectures,All Levels,Derek Banas
713,C# Tutorial: Full Course For Beginners - Fundamentals of C#,,Rating: 0.0 out of 5,0 reviews,26.5 total hours,16 lectures,Beginner,Furkan Gözükara
714,C++ Programming: The Coding Interview,Ace your next C++ coding interview by mastering data structures and algorithms.,Rating: 4.0 out of 5,14 reviews,2.5 total hours,29 lectures,Beginner,Programming Made Easy
715,Basic C# Programming with Visual Studio,Take your first step into the world of <strong>programming</strong> with this beginner course on C#. Become a programmer today!,Rating: 4.4 out of 5,38 reviews,1.5 total hours,15 lectures,Beginner,Programming Tut
716,Python for Absolute beginner (Python 3 - python programming),learn Python <strong>programming</strong> for beginners with hands-on exercises in this beginner friendly Python tutorial! with Examples,Rating: 4.6 out of 5,19 reviews,2.5 total hours,32 lectures,Beginner,Tom Science and Technology
717,Complete C++ Programming Fundamentals With Example Projects,Master the basics of C++ <strong>programming</strong> from beginner to advance & build your C++ <strong>programming</strong> skill with sample projects,Rating: 4.3 out of 5,33 reviews,17 total hours,161 lectures,All Levels,"Emenwa Global, Zoolord Academy"
718,Python Programming for Beginners with Hands on Tutorial,Learn Python <strong>Programming</strong>: Frequently asked Interview Questions Included,Rating: 4.4 out of 5,478 reviews,10.5 total hours,129 lectures,Beginner,Syed Mohiuddin
719,Learn programming from scratch with Python,"learn software <strong>programming</strong> starting from No Knowledge with the most powerful and popular <strong>programming</strong> language, python",Rating: 3.9 out of 5,91 reviews,11.5 total hours,135 lectures,All Levels,Daniele Protti
720,Embedded Systems Object-Oriented Programming in C,"End-to-End Firmware and Driver Development: UART,GPIO,TIMER, etc. From Datasheet to Embedded C and C++",Rating: 4.2 out of 5,279 reviews,12.5 total hours,45 lectures,All Levels,Israel Gbati
721,Learn Java Programming from Scratch with Examples and Demos,"Best Java <strong>Programming</strong> Course with Plenty of Programs, demos and Examples using BlueJ for Beginners in Java <strong>Programming</strong>",Rating: 3.9 out of 5,31 reviews,16.5 total hours,132 lectures,Beginner,Subrat Dash - Tankadhar Training and Research Center
722,Beginners Python Programming - Learn By Coding Games,Learn Python the fun way. Build arcade games with animation and sound. <strong>Programming</strong> for complete beginners of any age.,Rating: 4.5 out of 5,76 reviews,13.5 total hours,36 lectures,Beginner,Bob Grant
723,Building a Virtual Machine for Programming Language,Essentials of Low-level Interpretation,Rating: 4.9 out of 5,25 reviews,4.5 total hours,29 lectures,Intermediate,Dmitry Soshnikov
724,Step By Step Java Programming Complete Course,"Have a strong background in Java <strong>programming</strong> language,learn solutions of the most common problems,be experienced in Java",Rating: 4.5 out of 5,343 reviews,12.5 total hours,212 lectures,All Levels,AKINCI Training
725,Linux Kernel Programming - IPC b/w Userspace and KernelSpace,"System <strong>Programming</strong> - Learn Netlink Sockets, Operating Systems, Loadable Kernel Modules, C <strong>programming</strong> From Scratch",Rating: 4.4 out of 5,173 reviews,3 total hours,35 lectures,Beginner,"Abhishek CSEPracticals, Shiwani Nigam, Ekta Ekta"
726,Fundamentals of Programming,"The boring theory that YOU NEED if you want to make solid games and apps - Swift , C# Unity3D",Rating: 4.2 out of 5,460 reviews,2.5 total hours,43 lectures,Beginner,Yohann Taieb
727,Object Oriented Programming using Python + Pycharm Hands-on,Practical approach to object oriented <strong>programming</strong> using Python and Pycharm. Grow as a Python developer.,Rating: 4.3 out of 5,11 reviews,2.5 total hours,27 lectures,Intermediate,"Faisal Memon, EmbarkX Official"
728,Java Programming Complete Fundamentals,Learn java <strong>programming</strong> concepts and Basics. Master in java fundamentals and hands-on skills on AppDevelopment Servic,Rating: 4.8 out of 5,8 reviews,2.5 total hours,50 lectures,All Levels,Anil Kalaveni
729,Project Based Python Programming For Kids & Beginners,"Learn Hands-On Python <strong>Programming</strong> By Creating Games, GUIs and Graphics",Rating: 4.4 out of 5,738 reviews,5 total hours,56 lectures,All Levels,Minerva Singh
730,Programming for Complete Beginners in C#,"Learning to code C#?  We have provided HD video lectures, live coding sessions, and nearly 100 exercises to learn on!",Rating: 4.5 out of 5,2060 reviews,6.5 total hours,48 lectures,Beginner,Eric Wise
731,Introduction to TypeScript Development,"Get ready to build React, Vue and Angular web and mobile applications by learning the TypeScript <strong>programming</strong> language.",Rating: 4.5 out of 5,3478 reviews,8 total hours,49 lectures,Beginner,Jordan Hudgens
732,Java Object-Oriented Programming : Build a Quiz Application,Learn Java core object-oriented concepts and build a console-based quiz application.,Rating: 4.7 out of 5,177 reviews,2.5 total hours,37 lectures,All Levels,Abhay Redkar
733,The fundamentals of Python Programming Language,Into the Python's Lair,Rating: 4.7 out of 5,7 reviews,4.5 total hours,57 lectures,Beginner,Code Kontrol
734,C Programming 360° Bootcamp: Zero to Hero,,Rating: 4.8 out of 5,42 reviews,13.5 total hours,118 lectures,All Levels,Electrovert Labs
735,C Programming Language Hands-On-Lab Challenge,,Rating: 0.0 out of 5,0 reviews,22.5 total hours,140 lectures,All Levels,Atish Jain
736,Programming Practices for Software Engineers,,Rating: 0.0 out of 5,0 reviews,7 total hours,84 lectures,All Levels,RougeNeuron Academy
737,8086 Microprocessor - Architecture & Programming,,Rating: 5.0 out of 5,2 reviews,19 total hours,40 lectures,Intermediate,Dr. Yogesh Misra
738,The Guide to Computer Programming in Java,,Rating: 4.9 out of 5,4 reviews,7 total hours,48 lectures,All Levels,Alexandru Dincă
739,Programming with Python - part1,,Rating: 0.0 out of 5,0 reviews,4.5 total hours,17 lectures,Beginner,Alison A
740,Go Programming Bootcamp,,Rating: 4.8 out of 5,80 reviews,15.5 total hours,81 lectures,All Levels,Derek Banas
741,C# Tutorial: Full Course For Beginners - Fundamentals of C#,,Rating: 0.0 out of 5,0 reviews,26.5 total hours,16 lectures,Beginner,Furkan Gözükara
742,Python Masterclass| Basic to OOP Programming with Anaconda,Go From Beginner to Expert Programmer in this Python Masterclass! Learn the Basics to OOP!,Rating: 3.6 out of 5,47 reviews,3.5 total hours,49 lectures,All Levels,Programming Tut
743,Java Programming For Beginners - Theory+151 Solved Exercises,Learn Java <strong>programming</strong> through lots of practice and land that first IT job!,Rating: 4.6 out of 5,25 reviews,10 total hours,54 lectures,Beginner,Academia Programatorilor
744,Functional Programming in Python,"Use Functional <strong>Programming</strong> as a powerful tool to solve many real-world problems by writing robust, testable, and bug-fre",Rating: 3.7 out of 5,185 reviews,2.5 total hours,22 lectures,Intermediate,Packt Publishing
745,Mastering C++ Programming - From Zero to Hero,"Modern C++ with C++11 to C++17, In-depth coverage of OOPs,Templates,STL,Exception Handling,Basics to Advance C++",Rating: 4.5 out of 5,151 reviews,30.5 total hours,198 lectures,All Levels,Himayatullah Sharief
746,Functional Programming Deep Dive with C#,Take your code to the next level with Functional <strong>Programming</strong> in C#. Improve your software’s architecture. C# 9.0.,Rating: 4.4 out of 5,37 reviews,3.5 total hours,22 lectures,Intermediate,Cory West
747,OOP Object Oriented Programming In PHP 7,Learn advanced object oriented <strong>programming</strong> with simple code examples. This Course includes almost all OOP PHP7 topics.,Rating: 4.8 out of 5,728 reviews,6 total hours,136 lectures,Beginner,Saira Sadiq
748,Learn Python Programming to Land up in a Job,Learn Python <strong>programming</strong> from scratch till advance topic along with application and game development to land up in a job,Rating: 4.4 out of 5,147 reviews,17.5 total hours,75 lectures,All Levels,Suresh M S
749,Java Programming for Complete Stranger,Learn Java <strong>Programming</strong> with lot of examples. For Java Beginners! Let's learn OOP's,Rating: 4.5 out of 5,430 reviews,10 total hours,117 lectures,All Levels,Arun Ammasai
750,Java to Develop Programming Skills,"Java : Complete Java for Beginners .  Master skills in Java .  Java  from scratch to OOP , JDBC , COLLECTION , ENUM etc",Rating: 4.3 out of 5,349 reviews,27 total hours,232 lectures,Beginner,Sandeep Thakur
751,Data Structures And Algorithms In The C Programming Language,"Linked Lists, Array Lists, Stacks, Queues, Trees the lot!",Rating: 4.6 out of 5,108 reviews,2.5 total hours,15 lectures,Intermediate,Daniel McCarthy
752,The Complete 2022  C Programming Course. 100% Success .,Improve your Chances of Success with other Languages by 101% . Learn in less than 30 hours from a Friendly Instructor .,Rating: 4.6 out of 5,38 reviews,25.5 total hours,147 lectures,All Levels,Vee Kay
753,Object Oriented Programming with Java,Learn Java <strong>programming</strong> in easy steps from begining to advanced with example based training approach,Rating: 4.3 out of 5,56 reviews,10.5 total hours,97 lectures,All Levels,Samir Thakkar
754,Hands-on Scratch Programming and Game Development,"Imagine, Create and Share scratch <strong>programming</strong> and 2D games (Comprehensive Guide for newbies)",Rating: 4.9 out of 5,60 reviews,2 total hours,24 lectures,Beginner,Osama Ali
755,Java programming language - JAVA for BEGINNERS course,Start coding with JAVA in no time,Rating: 4.8 out of 5,99 reviews,3 total hours,46 lectures,Beginner,Baked Brackets
756,Variable Frequency Drive PowerFlex 525 VFD Programming Setup,"Electrical Hardware Engineering & Variable Frequency Drive <strong>Programming</strong> | PLC, HMI, Allen Bradley RSLogix 5000",Rating: 4.4 out of 5,612 reviews,2 total hours,16 lectures,All Levels,Vladimir Romanov
757,Functional Programming in 7 Days,Take a 7-day journey to the functional paradigm of Python <strong>programming</strong>,Rating: 3.9 out of 5,14 reviews,5 total hours,36 lectures,Beginner,Packt Publishing
758,Object-Oriented Programming with JavaScript,Learn how to work with an object-oriented <strong>programming</strong> model in one of the web's most popular languages.,Rating: 4.9 out of 5,73 reviews,2 total hours,29 lectures,Intermediate,Infinite Skills
759,Computer Programming in Python and JavaScript (Intermediate),Master Python and JavaScript <strong>programming</strong>! Build exciting projects hands-on with industry tools PyCharm and VS Code!,Rating: 4.3 out of 5,29 reviews,2.5 total hours,40 lectures,Beginner,Robert Gioia
760,Create a NEW programming Language from scratch,Learn to create <strong>programming</strong> language and create a compiler for <strong>programming</strong> language from scratch,Rating: 2.5 out of 5,91 reviews,1.5 total hours,7 lectures,All Levels,"Harshit Srivastava, Pranjal Srivastava"
761,WPF & XAML: Build 10 WPF applications (C#) in 2020,Learn XAML and WPF development on 10 projects. WPF/C# <strong>programming</strong> even for beginners,Rating: 4.1 out of 5,358 reviews,6 total hours,49 lectures,Beginner,Luke's Programming School
762,C Programming 360° Bootcamp: Zero to Hero,,Rating: 4.8 out of 5,42 reviews,13.5 total hours,118 lectures,All Levels,Electrovert Labs
763,C Programming Language Hands-On-Lab Challenge,,Rating: 0.0 out of 5,0 reviews,22.5 total hours,140 lectures,All Levels,Atish Jain
764,Programming Practices for Software Engineers,,Rating: 0.0 out of 5,0 reviews,7 total hours,84 lectures,All Levels,RougeNeuron Academy
765,8086 Microprocessor - Architecture & Programming,,Rating: 5.0 out of 5,2 reviews,19 total hours,40 lectures,Intermediate,Dr. Yogesh Misra
766,The Guide to Computer Programming in Java,,Rating: 4.9 out of 5,4 reviews,7 total hours,48 lectures,All Levels,Alexandru Dincă
767,Programming with Python - part1,,Rating: 0.0 out of 5,0 reviews,4.5 total hours,17 lectures,Beginner,Alison A
768,Go Programming Bootcamp,,Rating: 4.8 out of 5,80 reviews,15.5 total hours,81 lectures,All Levels,Derek Banas
769,C# Tutorial: Full Course For Beginners - Fundamentals of C#,,Rating: 0.0 out of 5,0 reviews,26.5 total hours,16 lectures,Beginner,Furkan Gözükara
770,Java Programming For Complete Beginners Using Eclipse IDE,"Learn Java <strong>Programming</strong> step-by-step, complete Java hands-on course for complete beginners using Eclipse IDE",Rating: 4.5 out of 5,273 reviews,7 total hours,45 lectures,All Levels,"Syed Raza, Syed Ali, Qasim Shah, ClayDesk E-learning"
771,PLC Programming in Siemens TIA Portal,A beginners level course in PLC and HMI <strong>programming</strong>,Rating: 4.4 out of 5,317 reviews,5.5 total hours,36 lectures,Beginner,Seyed Parvini
772,Java Programming for Absolute Beginners,The essentials of Java all in one easy to understand course.,Rating: 4.6 out of 5,59 reviews,3 total hours,20 lectures,Beginner,Stone River eLearning
773,Introduction to Programming: C/C++,A Master Course from Beginner to Expert,Rating: 4.0 out of 5,37 reviews,11 total hours,35 lectures,All Levels,"Daniel Szelogowski, M.S."
774,Cracking  Java Programming Interview for Automation Testers,Java coding Interview questions for Automation Testers|Core java <strong>programming</strong>|Java for selenium interview,Rating: 4.3 out of 5,122 reviews,4.5 total hours,31 lectures,Beginner,Kiran Singh
775,C Programming Language Demystified,Through the use of animation this course will demystify the internals of the C language in a way that anyone can learn!,Rating: 4.2 out of 5,196 reviews,19 total hours,150 lectures,All Levels,"Bhalchandra Gholkar, Daryl Newell"
776,"From 0 to 1: Learn Java Programming -Live Free,Learn To Code",An accessible yet serious guide to Java <strong>programming</strong> for everyone,Rating: 4.5 out of 5,220 reviews,17 total hours,84 lectures,All Levels,Loony Corn
777,learn programming logic with java course 2021,"if you want to learn <strong>programming</strong> using the java language, i suggest you take a look inside this one,you wont regret it.",Rating: 4.2 out of 5,5 reviews,21 total hours,79 lectures,Beginner,Yoel fisher
778,Python for Beginners: Learn Python Programming (in Python 3),This Python for beginners course teaches you Python language quick. Go from hero to zero in Python. Training in Python 3,Rating: 3.9 out of 5,1028 reviews,11 total hours,33 lectures,All Levels,TechnoBytes | Take Learning to Byte Level
779,Begin Programming with Modern C++,"Teaches you how to program computers, using the C++ <strong>programming</strong> language.",Rating: 4.1 out of 5,178 reviews,13.5 total hours,99 lectures,Beginner,James Raynard
780,The Developers Guide to Python 3 Programming,Learn the latest version of Python 3 <strong>programming</strong> language,Rating: 4.3 out of 5,19 reviews,4.5 total hours,23 lectures,Beginner,"Eduonix Learning Solutions, Eduonix-Tech ., Eduonix Support"
781,Learn and Master C Programming For Absolute Beginners!,"Become C code expert in Visual Studio on Windows! Learn about arrays, pointers, files, strings, dynamic memory and more!",Rating: 4.5 out of 5,542 reviews,14 total hours,150 lectures,All Levels,Mohammad El-Haj
782,Learn The Fundamentals of Programming: Core Concepts,Learn the fundamentals of computer science for <strong>programming</strong>,Rating: 4.6 out of 5,77 reviews,1.5 total hours,21 lectures,All Levels,VICONIC Development
783,Complete python programming for beginners,Python: Learn Complete Python <strong>Programming</strong> Latest version 3.4.2  from scratch for beginners and also learn GUI in python.,Rating: 4.0 out of 5,511 reviews,7.5 total hours,84 lectures,All Levels,DoEdu IT Educations
784,Practical C++ Programming Practices (100+ Common Projects),Master C++ <strong>programming</strong> with over 100 best C++ <strong>programming</strong> practices for absolute beginners to excel in the industry,Rating: 3.2 out of 5,40 reviews,11 total hours,108 lectures,All Levels,"Emenwa Global, Zoolord Academy"
785,Python & SoftwareEng: Professional Programming for Beginners,Hands-on training to become professional software engineers. Learn concepts and practises in a contextual manner.,Rating: 4.3 out of 5,23 reviews,12 total hours,66 lectures,Beginner,Sriram Vajapeyam
786,Complete C Programming Fundamentals With Example Projects,Learn C <strong>programming</strong> today! Master the fundamentals of C & build your C <strong>programming</strong> skill with Best C language projects,Rating: 3.9 out of 5,131 reviews,22 total hours,194 lectures,All Levels,"Emenwa Global, Zoolord Academy"
787,Learn Python3 Programming,Core Python <strong>Programming</strong> for Software Testers/Developers/Data Science/Machine Learning,Rating: 4.2 out of 5,77 reviews,16.5 total hours,33 lectures,All Levels,Pavan Kumar
788,PHP Programming For Everyone,Learn PHP <strong>Programming</strong> For Web Development The Fast And Easy Way!,Rating: 4.5 out of 5,36 reviews,2.5 total hours,27 lectures,Beginner,John Elder
789,Competitive Programming,Master the Theory and Application of Algorithms and Data Structures to Excel in <strong>Programming</strong> Contests,Rating: 3.9 out of 5,76 reviews,11.5 total hours,140 lectures,All Levels,Blanca Huergo
790,C Programming 360° Bootcamp: Zero to Hero,,Rating: 4.8 out of 5,42 reviews,13.5 total hours,118 lectures,All Levels,Electrovert Labs
791,C Programming Language Hands-On-Lab Challenge,,Rating: 0.0 out of 5,0 reviews,22.5 total hours,140 lectures,All Levels,Atish Jain
792,Programming Practices for Software Engineers,,Rating: 0.0 out of 5,0 reviews,7 total hours,84 lectures,All Levels,RougeNeuron Academy
793,8086 Microprocessor - Architecture & Programming,,Rating: 5.0 out of 5,2 reviews,19 total hours,40 lectures,Intermediate,Dr. Yogesh Misra
794,The Guide to Computer Programming in Java,,Rating: 4.9 out of 5,4 reviews,7 total hours,48 lectures,All Levels,Alexandru Dincă
795,Programming with Python - part1,,Rating: 0.0 out of 5,0 reviews,4.5 total hours,17 lectures,Beginner,Alison A
796,Go Programming Bootcamp,,Rating: 4.8 out of 5,80 reviews,15.5 total hours,81 lectures,All Levels,Derek Banas
797,C# Tutorial: Full Course For Beginners - Fundamentals of C#,,Rating: 0.0 out of 5,0 reviews,26.5 total hours,16 lectures,Beginner,Furkan Gözükara
798,Learn and Practice C programming for beginners,"C <strong>programming</strong> for beginners,fundamentals of C <strong>programming</strong>, C for absolute beginners,C coding,C exercises,C language",Rating: 3.8 out of 5,20 reviews,5.5 total hours,46 lectures,Beginner,Zaki Badr
799,Dynamic Programming - I,Master the art of solving Dynamic <strong>Programming</strong> problems and acing the Coding Interviews,Rating: 4.3 out of 5,619 reviews,2.5 total hours,13 lectures,All Levels,Sweet Codey
800,Python and Ruby programming Complete step-by-step Tutorial,Learn complete python and ruby <strong>programming</strong> languages from scratch. Also learn GUI <strong>Programming</strong>.,Rating: 3.5 out of 5,242 reviews,13 total hours,160 lectures,All Levels,DoEdu IT Educations
801,Build a Complete Programming Language,Understand the concept of how <strong>programming</strong> languages are working and build complete <strong>programming</strong> Language from scratch,Rating: 3.3 out of 5,14 reviews,4 total hours,39 lectures,Beginner,Nawaf Alluqmani
802,Multi-Paradigm Programming with Modern C++,"Write clean, fast, concurrent code with key features of C++ 14,17, and now 20.",Rating: 4.4 out of 5,75 reviews,7.5 total hours,64 lectures,Beginner,Packt Publishing
803,The Scratch Academy - Entry Level Computer Programming,Give your yourself a head start - learn to code by starting with the basics!,Rating: 4.6 out of 5,22 reviews,2 total hours,26 lectures,Beginner,Benjamin East
804,Functional-style Programming in Java using Lambdas & Streams,Write elegant & efficient code by mastering Functional <strong>Programming</strong> in Java through constructs such as Lambdas & Streams!,Rating: 4.6 out of 5,10 reviews,6.5 total hours,31 lectures,All Levels,Dheeru Mundluru
805,C Programming Made easy for Beginners -Step by Step Approach,"Solve Online Coding Challenges along with Fundamentals , Arrays, Functions, Recursion, Pointers, Structures and Files.",Rating: 4.4 out of 5,215 reviews,23 total hours,157 lectures,All Levels,Himayatullah Sharief
806,Master Object Oriented Programming (OOP) in Python 3,OOP in Python 3 | All four pillars of Object Oriented <strong>Programming</strong> in Python 3 for beginners from scratch,Rating: 3.8 out of 5,63 reviews,2.5 total hours,23 lectures,All Levels,Ghulam Abbas
807,Top Python and PHP Programming Bundle,"Learn Python <strong>Programming</strong> and PHP For Web Development Fast! Become a Software Engineer, Coder, Hacker, or Web Developer",Rating: 4.4 out of 5,103 reviews,8 total hours,85 lectures,Beginner,John Elder
808,Python OOP:Master Objected Oriented Programming(in Python 3),Python OOP: Learn Oriented <strong>Programming</strong> in Python easily with examples and excercises. Build real life projects using OOP,Rating: 4.2 out of 5,60 reviews,9.5 total hours,41 lectures,Intermediate,TechnoBytes | Take Learning to Byte Level
809,Programming Java for Beginners - The Ultimate Java Tutorial,Learn Java <strong>Programming</strong> at your own Pace. Comes Complete with Working Files and a Verifiable Certificate of Completion.,Rating: 4.5 out of 5,1374 reviews,10 total hours,114 lectures,All Levels,Infinite Skills
810,Reactive programming with RxJava,"Learn functional reactive <strong>programming</strong> with RxJava, a library for easy asynchronous <strong>programming</strong>",Rating: 4.2 out of 5,32 reviews,3 total hours,26 lectures,Intermediate,German Muzquiz Rodriguez
