,Course Title,Course Headline,Rating,Reviews,Course Length,Lectures,Level,Instructor
934,The Guide to Computer Programming in Java,,Rating: 4.9 out of 5,4 reviews,7 total hours,48 lectures,All Levels,Alexandru Dincă
935,Programming with Python - part1,,Rating: 0.0 out of 5,0 reviews,4.5 total hours,17 lectures,Beginner,Alison A
936,Go Programming Bootcamp,,Rating: 4.8 out of 5,80 reviews,15.5 total hours,81 lectures,All Levels,Derek Banas
937,C# Tutorial: Full Course For Beginners - Fundamentals of C#,,Rating: 0.0 out of 5,0 reviews,26.5 total hours,16 lectures,Beginner,Furkan Gözükara
938,Java for Competitive Programming from Scratch - Intermediate,Prepare for the future by keeping yourself updated with this course on fundamentals of Java <strong>programming</strong>.,Rating: 3.6 out of 5,54 reviews,2.5 total hours,15 lectures,Beginner,Karthik K N
939,C++ Programming - Beginners to Beyond,Learn C++ basics and advanced concepts. Take your C++ <strong>programming</strong> to the next level.,Rating: 4.1 out of 5,22 reviews,14 total hours,48 lectures,All Levels,Smart Coders Hub
940,Learn Data Structures using C Programming Language,"Hands-on course with exercises on arrays, stacks, queues, linked list, trees, graphs, internal sorting techniques, etc.",Rating: 3.7 out of 5,59 reviews,9 total hours,90 lectures,All Levels,Gayatri TR
941,Strings for C Programming MCQ Practice Questions,Examination Preparation and Interview questions on Strings for C <strong>Programming</strong>,Rating: 2.8 out of 5,10 reviews,49 questions,,All Levels,Manu Mitra
942,"Structures, Unions, Enums for C Programming MCQ Practice","Examination Preparation and Interview questions on Structures, Unions, Enums for C <strong>Programming</strong>",Rating: 3.9 out of 5,16 reviews,53 questions,,All Levels,Manu Mitra
943,Pointers for C Programming MCQ Practice Questions,Examination Preparation and Interview questions on Pointers for C <strong>Programming</strong>,Rating: 3.4 out of 5,22 reviews,51 questions,,All Levels,Manu Mitra
944,Learn to Read Any Programming Language in 1 hour!,Python <strong>Programming</strong>; Learn to Any <strong>Programming</strong> Language in 1 hour!,Rating: 3.2 out of 5,49 reviews,1 total hour,16 lectures,Beginner,Sudo Upgrade
945,Java: Socket Programming Simplified,"Build the foundations for server side <strong>programming</strong>, a MUST learn for server side application developers/aspirants.",Rating: 5.0 out of 5,520 reviews,2 total hours,16 lectures,Beginner,Sagar Uppuluri
946,Introduction To Programming with Python,Learn <strong>programming</strong> from basics up to think in <strong>programming</strong> with python (Python online training ),Rating: 4.3 out of 5,460 reviews,2.5 total hours,17 lectures,Beginner,Hanif Ullah
947,Learn programming with Python,Learn Python,Rating: 4.3 out of 5,1176 reviews,12 total hours,110 lectures,Beginner,Omar Alsabbagh
948,Object Oriented Programming in Python,Learn about classes and objects in Python through some interesting analogies,Rating: 4.5 out of 5,153 reviews,2 total hours,7 lectures,All Levels,Sujithkumar MA
949,Introduction to Python Programming,Start your <strong>programming</strong> career by learning how to program in Python,Rating: 4.2 out of 5,432 reviews,1.5 total hours,29 lectures,Beginner,Tanner Siciliano
950,Learn Programming in Python! - Data Visualization in Python,Learn to visualize data using Pyplot and master the Python <strong>Programming</strong> Language!,Rating: 4.3 out of 5,206 reviews,38 total mins,7 lectures,Intermediate,Nirmali Khound Baruah
951,An Introduction to Python Programming,"Learn the Fundamentals of Procedural, Object-Oriented, and Functional <strong>Programming</strong> in Python.",Rating: 4.0 out of 5,406 reviews,1.5 total hours,19 lectures,Beginner,Rishi Desai
952,Python Programming,Python <strong>Programming</strong> for Beginners,Rating: 4.3 out of 5,27 reviews,2 total hours,8 lectures,All Levels,Prof. Dr. Academic Educator
953,Python Programming Fundamentals,A comprehensive Python course with illustrated examples and loads of hands on exercises,Rating: 4.0 out of 5,381 reviews,3 total hours,25 lectures,Beginner,HiTech Squad
954,Beginning with Python Programming,Python <strong>Programming</strong> Tutorials,Rating: 3.5 out of 5,115 reviews,2 total hours,16 lectures,Intermediate,Madhavi Vaidya
955,Python Programming for Beginners: Learn to Code in an Hour,An Introduction to Basic Computer Science Fundamentals,Rating: 4.3 out of 5,264 reviews,1.5 total hours,11 lectures,Beginner,Lunar Pilot
956,Robust Qt & C++ Gui Programming 2D Graphics App Tutorial,Become a confident Qt GUI and C++ software developer with step by step <strong>programming</strong> tutorials and 2D graphics examples,Rating: 4.9 out of 5,566 reviews,3 total hours,40 lectures,Beginner,Dan Munteanu
957,Coding Essentials - Logic Building for Beginners,"Enter the world of <strong>programming</strong>, learn fundamental building blocks of <strong>programming</strong> & problem solving for beginners.",Rating: 4.3 out of 5,692 reviews,2 total hours,29 lectures,Beginner,"Prateek Narang, Coding Minutes"
958,C Programming 360° Bootcamp: Zero to Hero,,Rating: 4.8 out of 5,42 reviews,13.5 total hours,118 lectures,All Levels,Electrovert Labs
959,C Programming Language Hands-On-Lab Challenge,,Rating: 0.0 out of 5,0 reviews,22.5 total hours,140 lectures,All Levels,Atish Jain
960,Programming Practices for Software Engineers,,Rating: 0.0 out of 5,0 reviews,7 total hours,84 lectures,All Levels,RougeNeuron Academy
961,8086 Microprocessor - Architecture & Programming,,Rating: 5.0 out of 5,2 reviews,19 total hours,40 lectures,Intermediate,Dr. Yogesh Misra
962,The Guide to Computer Programming in Java,,Rating: 4.9 out of 5,4 reviews,7 total hours,48 lectures,All Levels,Alexandru Dincă
963,Programming with Python - part1,,Rating: 0.0 out of 5,0 reviews,4.5 total hours,17 lectures,Beginner,Alison A
964,Go Programming Bootcamp,,Rating: 4.8 out of 5,80 reviews,15.5 total hours,81 lectures,All Levels,Derek Banas
965,C# Tutorial: Full Course For Beginners - Fundamentals of C#,,Rating: 0.0 out of 5,0 reviews,26.5 total hours,16 lectures,Beginner,Furkan Gözükara
966,An Introduction to Java Programming,Learn the Fundamentals of Procedural <strong>Programming</strong> in Java,Rating: 4.0 out of 5,380 reviews,1.5 total hours,14 lectures,Beginner,Rishi Desai
967,Mastering Python Programming (Nov 2020),"With <strong>programming</strong> on Cloud, Datascience and Machine Learning",Rating: 4.0 out of 5,73 reviews,2 total hours,25 lectures,All Levels,Proton Expert Systems & Solutions
968,Basics Of Java Programming,Introduction of basic concepts of java for java Beginners,Rating: 3.9 out of 5,103 reviews,1.5 total hours,5 lectures,Beginner,Kumar P
969,Getting started with Python - programming in Python 3.,"Start from ""Hello world"" and go till all loop conditions and user defined functions.",Rating: 4.4 out of 5,72 reviews,33 total mins,19 lectures,Beginner,Aalekh Rai
970,Programming Best Practices,How to follow <strong>programming</strong> best practices? Know the best practices followed in professional software development.,Rating: 3.8 out of 5,411 reviews,27 total mins,9 lectures,All Levels,Amalendu Kundu
971,Python Programming - Basics and Hands On,"The basics of python, its installation and step-by-step movement towards the advanced concepts",Rating: 4.4 out of 5,19 reviews,1.5 total hours,6 lectures,Beginner,Rupali Vilas Chothe
972,Dynamic Programming,DP,Rating: 2.8 out of 5,15 reviews,1.5 total hours,10 lectures,All Levels,Vijay A
973,Functions using Python Programming,Functions in <strong>Programming</strong>,Rating: 4.1 out of 5,19 reviews,36 total mins,10 lectures,All Levels,Madhuri shinde
974,Learn Android Wear Programming,Guide to learn and create Android Wear Programs using Android Studio and Eclipse,Rating: 4.3 out of 5,291 reviews,6.5 total hours,42 lectures,All Levels,- SchoolSteps
975,Perl Programming,A Course on Perl <strong>Programming</strong>,Rating: 4.1 out of 5,58 reviews,1 total hour,12 lectures,All Levels,DIGIFLAX E-LEARNING
976,The Ultimate 2022 Scratch Programming Course,"Specifically designed for kids, non-programmers and those who think <strong>programming</strong> is difficult",Rating: 4.4 out of 5,40 reviews,2 total hours,16 lectures,Beginner,Naveed Chaudhry
977,Core Java - Basics and Object Oriented Programming(FREE),"Basic Java, statements, loops, arrays, class, constructor, methods",Rating: 4.3 out of 5,113 reviews,2 total hours,9 lectures,Beginner,Suresh Kumar Reddy
978,Programming fundamentals - Beginner's guide,Learn about computers and <strong>programming</strong>,Rating: 3.9 out of 5,12 reviews,1 total hour,9 lectures,Beginner,Sarayu Kocharlakota
979,Lifetime Course for Competitive Programming in C++ (2022),This is an introductory level course which will teach the basics of problem solving and the concepts revolving it.,Rating: 4.5 out of 5,23 reviews,2 total hours,14 lectures,All Levels,Rohith Boppey
980,Algorithms. Development of Programming Logic,Develop your <strong>Programming</strong> Logic by creating Algorithms,Rating: 4.2 out of 5,87 reviews,2 total hours,17 lectures,Beginner,Jose Javier Villena
981,C Programming Bootcamp: From Scratch,An Amazing Coding Experience,Rating: 4.2 out of 5,248 reviews,1.5 total hours,23 lectures,All Levels,Akash porwal
982,Object oriented programming in C++,Basic concepts of C++,Rating: 3.5 out of 5,91 reviews,2 total hours,10 lectures,Beginner,Chetashri bhusari
983,Learn C# Programming With Database from Scratch,Detailed C# <strong>Programming</strong> with Database,Rating: 4.3 out of 5,275 reviews,2 total hours,10 lectures,All Levels,Maxwell Taprah
984,[NEW] Functional programming for javascript developers,Learn functional <strong>programming</strong> and how it enables developers to move from imperative to declarative <strong>programming</strong>,Rating: 3.3 out of 5,76 reviews,3 total hours,7 lectures,All Levels,Daniel Arzuaga
985,Competitive Programming for Beginners,Get started with your competitive <strong>programming</strong> journey by learning the building blocks of CP's world.,Rating: 4.0 out of 5,66 reviews,1 total hour,18 lectures,Beginner,"Ajay Dhruv, Ph.D., Kushagra Soni, Shraddha Babar, Siddhi Suryavanshi, Tanaya Desai, Zeel Mehta, Komal Rane"
986,C Programming 360° Bootcamp: Zero to Hero,,Rating: 4.8 out of 5,42 reviews,13.5 total hours,118 lectures,All Levels,Electrovert Labs
987,C Programming Language Hands-On-Lab Challenge,,Rating: 0.0 out of 5,0 reviews,22.5 total hours,140 lectures,All Levels,Atish Jain
988,Programming Practices for Software Engineers,,Rating: 0.0 out of 5,0 reviews,7 total hours,84 lectures,All Levels,RougeNeuron Academy
989,8086 Microprocessor - Architecture & Programming,,Rating: 5.0 out of 5,2 reviews,19 total hours,40 lectures,Intermediate,Dr. Yogesh Misra
990,The Guide to Computer Programming in Java,,Rating: 4.9 out of 5,4 reviews,7 total hours,48 lectures,All Levels,Alexandru Dincă
991,Programming with Python - part1,,Rating: 0.0 out of 5,0 reviews,4.5 total hours,17 lectures,Beginner,Alison A
992,Go Programming Bootcamp,,Rating: 4.8 out of 5,80 reviews,15.5 total hours,81 lectures,All Levels,Derek Banas
993,C# Tutorial: Full Course For Beginners - Fundamentals of C#,,Rating: 0.0 out of 5,0 reviews,26.5 total hours,16 lectures,Beginner,Furkan Gözükara
994,Robotics Computer Programming - PTZ Camera Control Course,"Introduction to computer <strong>programming</strong> for robotics using HTML, Javascript, Node.js, and Python with PTZOptics cameras",Rating: 4.1 out of 5,75 reviews,1.5 total hours,7 lectures,Beginner,Paul Richards
995,Easy and Quick Python Programming for Kids-Foundation Course,Fun and friendly way of <strong>programming</strong> for kids,Rating: 3.7 out of 5,22 reviews,1 total hour,8 lectures,Beginner,"Mahesh Jadhav, Dhanashri jadhav"
996,C programming tutorial,1st developed <strong>programming</strong> language .,Rating: 3.7 out of 5,74 reviews,2 total hours,9 lectures,Beginner,Yash Kalam
997,Learn Basics of C++ Programming,Object Oriented <strong>Programming</strong>,Rating: 3.6 out of 5,23 reviews,1 total hour,12 lectures,All Levels,Shweta Jadhav
998,The Secret Smile / Programming Your Energy,How to Change How You Feel Anytime You Like,Rating: 4.2 out of 5,74 reviews,1 total hour,14 lectures,All Levels,Sixty Skills
999,First Steps in Programming with C# for Beginners,Learn Coding by Examples and by Solving Practical Problems with C# and Visual Studio,Rating: 4.5 out of 5,86 reviews,2 total hours,8 lectures,Beginner,"Svetlin Nakov, Preslav Mihaylov"
1000,Kids Programming: Fun Learning with Scratch Coding,"Scratch is a free block coding website for kids, developed by the MIT Media Lab. Scratch is its own <strong>programming</strong> language",Rating: 4.2 out of 5,87 reviews,1.5 total hours,6 lectures,Beginner,Codingal Education
1001,Features of Object oriented Programming language,Major features of OOP,Rating: 4.1 out of 5,61 reviews,1.5 total hours,9 lectures,Beginner,Vaishali Rajeev Lele
1002,PLC Programming 100,PLC and Control Systems,Rating: 4.3 out of 5,1000 reviews,1 total hour,33 lectures,Intermediate,Jonaz Sayson
1003,Introduction to Java Programming,"Java is a <strong>programming</strong> language.  Java is used to develop mobile apps, web apps, desktop apps, games and much more.",Rating: 4.2 out of 5,11 reviews,39 total mins,5 lectures,Beginner,Rohini Ashok Bhadane
1004,Programming Fundamentals - The Basics with C# for Beginners,"Learn the basics of <strong>programming</strong> with C#, this course is perfect for beginners.",Rating: 4.3 out of 5,1052 reviews,2 total hours,18 lectures,Beginner,Tod Vachev
1005,C#.Net Basics Programming Step by Step for Beginners-Part-01,"Learn C# <strong>Programming</strong>, the techniques to write better C# code and stand out in technical interviews",Rating: 4.2 out of 5,30 reviews,2 total hours,21 lectures,All Levels,RN Reddy IT School
1006,HTML5 Programming - Web Development Skills,A Complete HTML5 <strong>Programming</strong> Course for Beginners,Rating: 3.2 out of 5,15 reviews,1 total hour,15 lectures,All Levels,DIGIFLAX E-LEARNING
1007,PIC18 microcontroller Interface Programming in MPLAB X,"Introduction to PIC18, Its architecture, Port <strong>programming</strong> and Interfacing",Rating: 4.2 out of 5,14 reviews,1 total hour,5 lectures,Beginner,Smita Chaudhari
1008,100 Days of Code: The Complete Python Pro Bootcamp for 2023,"Master Python by building 100 projects in 100 days. Learn data science, automation, build websites, games and apps!",Rating: 4.7 out of 5,167538 reviews,64 total hours,676 lectures,All Levels,Dr. Angela Yu
1009,Python 3: Deep Dive (Part 4 - OOP),Python Object Oriented <strong>Programming</strong> (OOP),Rating: 4.8 out of 5,2252 reviews,36.5 total hours,166 lectures,Intermediate,Fred Baptiste
1010,Python Programming Bootcamp,A Complete Python Course Focused on Problem Solving that will Expand into All Python Can Do,Rating: 4.7 out of 5,2309 reviews,57.5 total hours,219 lectures,All Levels,Derek Banas
1011,Python for Absolute Beginners,The foundations you need to master the most in-demand <strong>programming</strong> language and truly understand what is going on,Rating: 4.8 out of 5,133 reviews,14 total hours,102 lectures,Beginner,"Mark Winterbottom, Brooke Rutherford"
1012,"Drum Programming Masterclass, Part 3: Advanced Programming","Build Better Beats through drum <strong>programming</strong> patterns and style tips including Hip Hop, Footwork, Funk, and much more!",Rating: 4.6 out of 5,61 reviews,3 total hours,43 lectures,Intermediate,Jason Allen
1013,Complete Python Bootcamp For Everyone From Zero to Hero 2023,"Master Python <strong>Programming</strong> by building 100+ REAL PROJECTS . Learn OOP, Automation,GUI,REST and more to create your APPs.",Rating: 4.6 out of 5,206 reviews,86 total hours,676 lectures,All Levels,Elshad Karimov
1014,C Programming 360° Bootcamp: Zero to Hero,,Rating: 4.8 out of 5,42 reviews,13.5 total hours,118 lectures,All Levels,Electrovert Labs
1015,C Programming Language Hands-On-Lab Challenge,,Rating: 0.0 out of 5,0 reviews,22.5 total hours,140 lectures,All Levels,Atish Jain
1016,Programming Practices for Software Engineers,,Rating: 0.0 out of 5,0 reviews,7 total hours,84 lectures,All Levels,RougeNeuron Academy
1017,8086 Microprocessor - Architecture & Programming,,Rating: 5.0 out of 5,2 reviews,19 total hours,40 lectures,Intermediate,Dr. Yogesh Misra
1018,The Guide to Computer Programming in Java,,Rating: 4.9 out of 5,4 reviews,7 total hours,48 lectures,All Levels,Alexandru Dincă
1019,Programming with Python - part1,,Rating: 0.0 out of 5,0 reviews,4.5 total hours,17 lectures,Beginner,Alison A
1020,Go Programming Bootcamp,,Rating: 4.8 out of 5,80 reviews,15.5 total hours,81 lectures,All Levels,Derek Banas
1021,C# Tutorial: Full Course For Beginners - Fundamentals of C#,,Rating: 0.0 out of 5,0 reviews,26.5 total hours,16 lectures,Beginner,Furkan Gözükara
1022,Python OOP : Four Pillars of OOP in Python 3 for Beginners,Python OOP Simplified: Learn Object Oriented <strong>Programming</strong> using Python in a way that you really understand,Rating: 4.6 out of 5,8686 reviews,2.5 total hours,25 lectures,Beginner,Febin George
1023,"C# Intermediate: Classes, Interfaces and OOP","An in-depth, step-by-step guide to classes, interfaces and object-oriented <strong>programming</strong> (OOP) with C#",Rating: 4.6 out of 5,31262 reviews,6 total hours,45 lectures,Intermediate,Mosh Hamedani
1024,Java SE 11 Developer 1Z0-819 OCP Course - Part 2,Getting Java Certified is great for your career.  Acquire the skills to pass the Oracle Java certification exam!,Rating: 4.5 out of 5,842 reviews,21 total hours,188 lectures,Intermediate,"Tim Buchalka, Tim Buchalka's Learn Programming Academy"
1025,"Concurrency, Multithreading and Parallel Computing in Java","Multithreading and Concurrent <strong>Programming</strong>, Parallel Computation and MapReduce in Java + Fork-Join and Stream API",Rating: 4.6 out of 5,2721 reviews,10.5 total hours,110 lectures,All Levels,Holczer Balazs
1026,C Programming 360° Bootcamp: Zero to Hero,"Your complete dose of C <strong>programming</strong> language basics, along with universal <strong>programming</strong> concepts & coding exercises.",Rating: 4.8 out of 5,42 reviews,13.5 total hours,118 lectures,All Levels,Electrovert Labs
1027,Python & Machine Learning for Financial Analysis,Master Python <strong>Programming</strong> Fundamentals and Harness the Power of ML to Solve Real-World Practical Applications in Finance,Rating: 4.4 out of 5,4053 reviews,23 total hours,131 lectures,All Levels,"Dr. Ryan Ahmed, Ph.D., MBA, Mitchell Bouchard"
1028,"Drum Programming Masterclass, Part 1: Rhythms & Patterns",Build Better Beats through drum <strong>programming</strong> patterns and style tips including hip hop drum <strong>programming</strong> and much more!,Rating: 4.7 out of 5,261 reviews,3 total hours,48 lectures,Beginner,Jason Allen
1029,Qt Widgets for Beginners with C++,"An introduction to Qt Widgets and Desktop <strong>programming</strong>, designed for students who know the Qt Core library",Rating: 4.4 out of 5,380 reviews,17.5 total hours,74 lectures,Beginner,Bryan Cairns
1030,2023 R Programming Bootcamp,"R <strong>Programming</strong> course suitable for everyone, no coding experience or a statistics background needed",Rating: 5.0 out of 5,35 reviews,1.5 total hours,23 lectures,All Levels,Surendra Varma Pericherla
1031,Java for complete beginners | Learn core java using IntelliJ,"Learn Java <strong>Programming</strong> by doing, Object Oriented <strong>Programming</strong> (oop java), IntelliJ for complete beginners using Java 17",Rating: 4.6 out of 5,2197 reviews,24 total hours,203 lectures,Intermediate,"Faisal Memon, EmbarkX Official"
1032,Python For Maya: Artist Friendly Programming,Learn to code with Python to work faster in Maya,Rating: 4.5 out of 5,1559 reviews,8 total hours,77 lectures,All Levels,Dhruv Govil
1033,The Nuts and Bolts of OAuth 2.0,"Covering OAuth 2.0, OpenID, PKCE, deprecated flows, JWTs, API Gateways, and scopes. No <strong>programming</strong> knowledge needed",Rating: 4.6 out of 5,5185 reviews,3.5 total hours,51 lectures,Intermediate,Aaron Parecki
1034,Learn Advanced Level Programming in Python,Make Advanced Level Applications using Advanced Level Concepts of Python,Rating: 5.0 out of 5,90 reviews,22 total hours,79 lectures,Expert,Team Python
1035,The Modern JavaScript Bootcamp,"Learn JavaScript by building real-world apps. Includes 3 real-world projects, 80 <strong>programming</strong> challenges, and ES6/ES7!",Rating: 4.7 out of 5,12666 reviews,29.5 total hours,155 lectures,All Levels,Andrew Mead
1036,Julia Programming Language - From Zero to Expert,"Learn the Next Gen Language for Data Science, Machine Learning and Numerical Computing",Rating: 4.7 out of 5,177 reviews,4 total hours,34 lectures,Beginner,Dr. Mohammad Nauman
1037,"Python REST APIs with Flask, Docker, MongoDB, and AWS DevOps","Learn Python coding with RESTful API's using the Flask framework. Understand how to use MongoDB, Docker and Tensor flow.",Rating: 4.4 out of 5,1986 reviews,10.5 total hours,51 lectures,Beginner,"Tim Buchalka's Learn Programming Academy, Faisal Memon"
1038,C# Programming: Start Coding in C#. Complete C# Programming,C# <strong>Programming</strong>: Learn the basics of C# <strong>programming</strong> with this complete C# <strong>programming</strong> course. C# <strong>programming</strong> from A-Z,Rating: 3.8 out of 5,280 reviews,3.5 total hours,50 lectures,Beginner,Zeeshan: C# Programming
1039,Python Mega Course : Go Beginner to Expert in Python3,"Python <strong>Programming</strong> Beginner to Advanced. MongoDB, SQLite, List, Tuple , OOP, Datastructure etc",Rating: 4.5 out of 5,2473 reviews,11 total hours,129 lectures,All Levels,Funky Programmer
1040,C++ in 6 hours : Learn C++ : Tutorial for beginners,Learn C++ <strong>Programming</strong> Basics in just 6 hours. Zero <strong>Programming</strong> experience required. Simply the Ultimate guide to C++,Rating: 4.8 out of 5,99 reviews,6.5 total hours,37 lectures,Beginner,Sarah Naseem
1041,Introduction to Programming in Python,Learn the basics of <strong>programming</strong> using the Python <strong>Programming</strong> Language!,Rating: 4.8 out of 5,14 reviews,5 total hours,35 lectures,Beginner,life michael
1042,C Programming 360° Bootcamp: Zero to Hero,,Rating: 4.8 out of 5,42 reviews,13.5 total hours,118 lectures,All Levels,Electrovert Labs
1043,C Programming Language Hands-On-Lab Challenge,,Rating: 0.0 out of 5,0 reviews,22.5 total hours,140 lectures,All Levels,Atish Jain
1044,Programming Practices for Software Engineers,,Rating: 0.0 out of 5,0 reviews,7 total hours,84 lectures,All Levels,RougeNeuron Academy
1045,8086 Microprocessor - Architecture & Programming,,Rating: 5.0 out of 5,2 reviews,19 total hours,40 lectures,Intermediate,Dr. Yogesh Misra
1046,The Guide to Computer Programming in Java,,Rating: 4.9 out of 5,4 reviews,7 total hours,48 lectures,All Levels,Alexandru Dincă
1047,Programming with Python - part1,,Rating: 0.0 out of 5,0 reviews,4.5 total hours,17 lectures,Beginner,Alison A
1048,Go Programming Bootcamp,,Rating: 4.8 out of 5,80 reviews,15.5 total hours,81 lectures,All Levels,Derek Banas
1049,C# Tutorial: Full Course For Beginners - Fundamentals of C#,,Rating: 0.0 out of 5,0 reviews,26.5 total hours,16 lectures,Beginner,Furkan Gözükara
1050,Java Streams API Developer Guide,Functional <strong>Programming</strong> with Java 8,Rating: 4.6 out of 5,3083 reviews,2.5 total hours,45 lectures,All Levels,Nelson Jamal
1051,Unity C# Scripting: Ultimate Guide to Game Programming 2023,Become a professional Unity Programmer and learn to write quality C# Code by creating amazing 2D-Games.,Rating: 4.9 out of 5,68 reviews,17.5 total hours,132 lectures,Beginner,Andreas Metz
1052,Data Science with R and Python | R Programming,"Python and R <strong>programming</strong>! Learn data science with R & Python with all in one course. You'll learn NumPy, Pandas and more",Rating: 4.6 out of 5,86 reviews,23.5 total hours,167 lectures,All Levels,Oak Academy
1053,Learn API Technical Writing: JSON and XML for Writers,API Documentation 1: Teaches technical writers how to document structured data. No <strong>programming</strong> experience required.,Rating: 4.5 out of 5,9325 reviews,1.5 total hours,16 lectures,Beginner,Peter Gruenbaum
1054,Windows Presentation Foundation Masterclass,"Leverage WPF with C# and XAML to build real world skills with Azure, REST, MVVM and Machine Learning",Rating: 4.4 out of 5,3876 reviews,20.5 total hours,132 lectures,All Levels,"Tim Buchalka's Learn Programming Academy, Eduardo Rosas"
1055,Learn to Code with Python 3,Go from beginner to advanced with the Python <strong>programming</strong> language!,Rating: 4.4 out of 5,4052 reviews,17.5 total hours,78 lectures,All Levels,Joseph Delgadillo
1056,Data Science: Python for Data Analysis 2023 Full Bootcamp,Learn and build your Python <strong>Programming</strong> skills from the ground up in addition to Python Data Science libraries and tools,Rating: 4.2 out of 5,1200 reviews,6 total hours,76 lectures,All Levels,"Ahmed Ibrahim, SDE Arts | Octavo"
1057,Python 3.7 - Programming Language Basics,Get the hang of Python <strong>Programming</strong> Language in Simplest Way!!,Rating: 4.4 out of 5,135 reviews,6.5 total hours,83 lectures,Beginner,Freedom 10x Ventures
1058,Python Object Oriented Programming (OOPs),Learn Python Object Oriented <strong>Programming</strong> step-by-step,Rating: 4.5 out of 5,41 reviews,2.5 total hours,29 lectures,Beginner,Jayanta Sarkar
