,Course Title,Course Headline,Rating,Reviews,Course Length,Lectures,Level,Instructor
0,100 Days of Code: The Complete Python Pro Bootcamp for 2023,"Master <strong>Python</strong> by building 100 projects in 100 days. Learn data science, automation, build websites, games and apps!",Rating: 4.7 out of 5,166237 reviews,64 total hours,676 lectures,All Levels,Dr. Angela Yu
1,The Complete Python Bootcamp From Zero to Hero in Python,Learn <strong>Python</strong> like a Professional  Start from the basics and go all the way to creating your own applications and games,Rating: 4.6 out of 5,448114 reviews,22 total hours,155 lectures,All Levels,Jose Portilla
2,Complete Python Developer in 2023: Zero to Mastery,"How to become a <strong>Python</strong> 3 Developer and get hired! Build 12+ projects, learn Web Development, Machine Learning + more!",Rating: 4.7 out of 5,44190 reviews,31 total hours,338 lectures,All Levels,"Andrei Neagoie, Zero To Mastery"
3,Web Developer Bootcamp with Flask and Python in 2022,"Become a Full Stack Web Developer using Flask, Python, HTML, CSS, and MongoDB! Fully updated for 2022 and beyond.",Rating: 4.6 out of 5,5923 reviews,20 total hours,186 lectures,Intermediate,"Jose Salvatierra, Teclado by Jose Salvatierra"
4,The Complete Python & PostgreSQL Developer Course,Build 9 projects—master two essential and modern technologies in Python and PostgreSQL,Rating: 4.6 out of 5,4882 reviews,22 total hours,186 lectures,Beginner,"Rob Percival, Jose Salvatierra, Codestars • over 2 million students worldwide!, Teclado by Jose Salvatierra"
5,REST APIs with Flask and Python in 2022,"Build professional REST APIs with Python, Flask, Docker, Flask-Smorest, and Flask-SQLAlchemy",Rating: 4.6 out of 5,19244 reviews,12 total hours,123 lectures,Intermediate,"Jose Salvatierra, Teclado by Jose Salvatierra"
6,Learn Python Programming Masterclass,This <strong>Python</strong> For Beginners Course Teaches You The <strong>Python</strong> Language  Fast.  Includes <strong>Python</strong> Online Training With <strong>Python</strong> 3,Rating: 4.6 out of 5,96061 reviews,72.5 total hours,534 lectures,All Levels,"Tim Buchalka, Jean-Paul Roberts, Tim Buchalka's Learn Programming Academy"
7,The Python Mega Course: Learn Python in 40 Days with 20 Apps,"2022 Redone! Take the full course to become a <strong>Python</strong> programmer, or pick any project to master specific areas of <strong>Python</strong>.",Rating: 4.7 out of 5,60263 reviews,40 total hours,371 lectures,All Levels,Ardit Sulce
8,Python for Absolute Beginners,Learn <strong>Python</strong> programming from scratch with hands-on exercises in this <strong>Python</strong> course!,Rating: 4.5 out of 5,24445 reviews,4.5 total hours,112 lectures,Beginner,Green Chameleon Learning
9,Python All In-One 2023 ™️ -Everything You'll Ever Need,,Rating: 4.7 out of 5,67 reviews,30.5 total hours,466 lectures,All Levels,Mouhammad Hamsho
10,Complete Python Bootcamp From Zero to Hero in Python 2023,,Rating: 0.0 out of 5,0 reviews,5 total hours,41 lectures,All Levels,Walid Hikal
11,Python Course From Zero | Python For All (Updated 2022),,Rating: 5.0 out of 5,6 reviews,7 total hours,49 lectures,All Levels,Mozn Akhourshiedah
12,Python For Absolute Beginners-Learn Python From Scratch 2022,,Rating: 5.0 out of 5,1 review,2 total hours,58 lectures,Beginner,Afridi Biswas
13,Python Weekend Bootcamp,,Rating: 0.0 out of 5,0 reviews,5 total hours,59 lectures,All Levels,Jeet Vora
14,Unlock the Power of Python: Master the Basics and Beyond!,,Rating: 5.0 out of 5,21 reviews,6.5 total hours,51 lectures,Beginner,Mosh Trials
15,Python 3: Fundamentals,,Rating: 5.0 out of 5,28 reviews,47.5 total hours,284 lectures,Beginner,Fred Baptiste
16,Master Python by Building Real World Python Projects,,Rating: 0.0 out of 5,0 reviews,2 total hours,18 lectures,All Levels,Vision Education
17,Python for Data Science and Machine Learning Bootcamp,"Learn how to use NumPy, Pandas, Seaborn , Matplotlib , Plotly , Scikit-Learn , Machine Learning, Tensorflow , and more!",Rating: 4.6 out of 5,125190 reviews,25 total hours,165 lectures,All Levels,Jose Portilla
18,The Complete Python Course | Learn Python by Doing in 2022,Go from Beginner to Expert in <strong>Python</strong> by building projects. The best investment for your <strong>Python</strong> journey!,Rating: 4.6 out of 5,18852 reviews,35.5 total hours,346 lectures,All Levels,"Codestars • over 2 million students worldwide!, Jose Salvatierra, Rob Percival, Teclado by Jose Salvatierra"
19,Automate the Boring Stuff with Python Programming,"A practical programming course for office workers, academics, and administrators who want to improve their productivity.",Rating: 4.7 out of 5,104646 reviews,9.5 total hours,51 lectures,All Levels,Al Sweigart
20,Python for beginners,Master the fundamentals of <strong>Python</strong> while working on various usecases in easy steps,Rating: 4.5 out of 5,21504 reviews,14 total hours,300 lectures,All Levels,Bharath Thippireddy
21,The Modern Python 3 Bootcamp,A Unique Interactive <strong>Python</strong> Experience With Nearly 200 Exercises and Quizzes,Rating: 4.7 out of 5,27551 reviews,30.5 total hours,377 lectures,Beginner,Colt Steele
22,Python 3: Deep Dive (Part 1 - Functional),"Variables, Functions and Functional Programming, Closures, Decorators, Modules and Packages",Rating: 4.8 out of 5,9070 reviews,46 total hours,162 lectures,Intermediate,Fred Baptiste
23,Python PCEP: Become Certified Entry-Level Python Programmer,Learn <strong>Python</strong> from scratch and pass the PCEP exam (Certified Entry-Level <strong>Python</strong> Programmer),Rating: 4.7 out of 5,1752 reviews,4 total hours,73 lectures,Beginner,Adrian Wiech
24,The Python Bible™ | Everything You Need to Program in Python,Build 11 Projects and go from Beginner to Pro in <strong>Python</strong> with the World's Most Fun Project-Based <strong>Python</strong> Course!,Rating: 4.6 out of 5,44408 reviews,9 total hours,74 lectures,Beginner,"Ziyad Yehia, Internet of Things Academy"
25,TOTAL Python: Become an Advanced Python Developer in 16 days,"One REAL <strong>Python</strong> project per day. From ZERO to Facial Recognition. Machine Learning, Data Science, Django, IGU, Games+",Rating: 4.6 out of 5,1926 reviews,26.5 total hours,225 lectures,All Levels,"Federico Garay, Phil Ebiner, Video School, Escuela Directa"
26,Learn to Code with Python,The complete <strong>Python</strong> bootcamp for 2022. Learn <strong>Python</strong> 3 from beginner to expert. Build complete <strong>Python</strong> applications.,Rating: 4.6 out of 5,4723 reviews,58 total hours,412 lectures,All Levels,Boris Paskhaver
27,Learn Python by making games,The most fun way to learn programming,Rating: 4.8 out of 5,609 reviews,27 total hours,142 lectures,Beginner,Christian Koch
28,Python Complete Masterclass for Beginners,"Learn <strong>Python</strong> including Excel/Database/Test/Network Automation, Data Analysis, Web Development, REST APIs, GraphQL & more",Rating: 4.5 out of 5,4479 reviews,30 total hours,416 lectures,Beginner,"Mihai Catalin Teodosiu, EpicPython Academy"
29,Python for Machine Learning & Data Science Masterclass,"Learn about Data Science and Machine Learning with <strong>Python</strong>! Including Numpy, Pandas, Matplotlib, Scikit-Learn and more!",Rating: 4.6 out of 5,10679 reviews,44 total hours,231 lectures,All Levels,Jose Portilla
30,Learn Complete Python In Simple Way,Direct Class Room Videos To give Left & Right Anywhere about <strong>Python</strong> 3 Concepts In Detail From Beginner to Expert Level,Rating: 4.7 out of 5,4948 reviews,114 total hours,422 lectures,All Levels,DURGASOFT DURGA
31,Automate Everything with Python,"Learn to build APIs, automate emails, web scraping, chatbots, RegEx, NLP, SQL, GUIs, schedule tasks, and more in <strong>Python</strong>!",Rating: 4.6 out of 5,912 reviews,20.5 total hours,184 lectures,Beginner,Ardit Sulce
32,The Data Science Course 2023: Complete Data Science Bootcamp,"Complete Data Science Training: Mathematics, Statistics, <strong>Python</strong>, Advanced Statistics in <strong>Python</strong>, Machine & Deep Learning",Rating: 4.6 out of 5,117520 reviews,32 total hours,517 lectures,All Levels,"365 Careers, 365 Careers Team"
33,Advanced Python Programming: Build 10 OOP Applications,Master <strong>Python</strong> from the inside out and learn how to build any <strong>Python</strong> program with ease using <strong>Python</strong> classes and OOP!,Rating: 4.6 out of 5,2212 reviews,23.5 total hours,229 lectures,Intermediate,Ardit Sulce
34,Web Developer Bootcamp with Flask and Python in 2022,"Become a Full Stack Web Developer using Flask, Python, HTML, CSS, and MongoDB! Fully updated for 2022 and beyond.",Rating: 4.6 out of 5,5923 reviews,20 total hours,186 lectures,Intermediate,"Jose Salvatierra, Teclado by Jose Salvatierra"
35,The Complete Python & PostgreSQL Developer Course,Build 9 projects—master two essential and modern technologies in Python and PostgreSQL,Rating: 4.6 out of 5,4882 reviews,22 total hours,186 lectures,Beginner,"Rob Percival, Jose Salvatierra, Codestars • over 2 million students worldwide!, Teclado by Jose Salvatierra"
36,REST APIs with Flask and Python in 2022,"Build professional REST APIs with Python, Flask, Docker, Flask-Smorest, and Flask-SQLAlchemy",Rating: 4.6 out of 5,19244 reviews,12 total hours,123 lectures,Intermediate,"Jose Salvatierra, Teclado by Jose Salvatierra"
37,Machine Learning A-Z™: Python & R in Data Science [2022],Learn to create Machine Learning Algorithms in <strong>Python</strong> and R from two Data Science experts. Code templates included.,Rating: 4.5 out of 5,164754 reviews,42.5 total hours,382 lectures,All Levels,"Kirill Eremenko, Hadelin de Ponteves, Ligency I Team, Ligency Team"
38,Python and Django Full Stack Web Developer Bootcamp,"Learn to build websites with HTML , CSS , Bootstrap , Javascript , jQuery , <strong>Python</strong> 3 , and Django!",Rating: 4.5 out of 5,46086 reviews,32 total hours,198 lectures,All Levels,Jose Portilla
39,Data Analysis with Pandas and Python,Analyze data quickly and easily with <strong>Python</strong>'s powerful pandas library! All datasets included --- beginners welcome!,Rating: 4.6 out of 5,18545 reviews,22 total hours,207 lectures,All Levels,Boris Paskhaver
40,Python All In-One 2023 ™️ -Everything You'll Ever Need,,Rating: 4.7 out of 5,67 reviews,30.5 total hours,466 lectures,All Levels,Mouhammad Hamsho
41,Complete Python Bootcamp From Zero to Hero in Python 2023,,Rating: 0.0 out of 5,0 reviews,5 total hours,41 lectures,All Levels,Walid Hikal
42,Python Course From Zero | Python For All (Updated 2022),,Rating: 5.0 out of 5,6 reviews,7 total hours,49 lectures,All Levels,Mozn Akhourshiedah
43,Python For Absolute Beginners-Learn Python From Scratch 2022,,Rating: 5.0 out of 5,1 review,2 total hours,58 lectures,Beginner,Afridi Biswas
44,Python Weekend Bootcamp,,Rating: 0.0 out of 5,0 reviews,5 total hours,59 lectures,All Levels,Jeet Vora
45,Unlock the Power of Python: Master the Basics and Beyond!,,Rating: 5.0 out of 5,21 reviews,6.5 total hours,51 lectures,Beginner,Mosh Trials
46,Python 3: Fundamentals,,Rating: 5.0 out of 5,28 reviews,47.5 total hours,284 lectures,Beginner,Fred Baptiste
47,Master Python by Building Real World Python Projects,,Rating: 0.0 out of 5,0 reviews,2 total hours,18 lectures,All Levels,Vision Education
48,Python 3: Deep Dive (Part 4 - OOP),<strong>Python</strong> Object Oriented Programming (OOP),Rating: 4.9 out of 5,2249 reviews,36.5 total hours,166 lectures,Intermediate,Fred Baptiste
49,Python for Finance: Investment Fundamentals & Data Analytics,Learn <strong>Python</strong> Programming and Conduct Real-World Financial Analysis in <strong>Python</strong> - Complete <strong>Python</strong> Training,Rating: 4.6 out of 5,25467 reviews,9 total hours,133 lectures,All Levels,365 Careers
50,Make 20 Advanced Level Applications in Python,Learn to make real time Applications in <strong>Python</strong> using Machine Learning Models and Advance Level concepts.,Rating: 4.7 out of 5,357 reviews,24 total hours,152 lectures,Intermediate,Python School
51,Learn Python: The Complete Python Programming Course,"Learn A-Z everything about <strong>Python</strong>, from the basics, to advanced topics like <strong>Python</strong> GUI, <strong>Python</strong> Data Analysis, and more!",Rating: 4.2 out of 5,4377 reviews,14.5 total hours,146 lectures,All Levels,"Avinash Jain, The Codex"
52,Data Structures & Algorithms - Python,DSA for the Cracking the Coding Interview.  ⚡ Animated Examples for Faster Learning and Deeper Understanding.,Rating: 4.7 out of 5,3383 reviews,8 total hours,109 lectures,All Levels,Scott Barrett
53,One Week Python,"A Quick and Effective Way To Learn <strong>Python</strong>, Made For Busy People",Rating: 4.8 out of 5,1485 reviews,14.5 total hours,190 lectures,Beginner,Colt Steele
54,REST APIs with Flask and Python in 2022,"Build professional REST APIs with <strong>Python</strong>, Flask, Docker, Flask-Smorest, and Flask-SQLAlchemy",Rating: 4.6 out of 5,19235 reviews,12 total hours,123 lectures,Intermediate,"Jose Salvatierra, Teclado by Jose Salvatierra"
55,The Complete Data Structures and Algorithms Course in Python,Data Structures and Algorithms from Zero to Hero and Crack Top Companies 100+ Interview questions (<strong>Python</strong> Coding),Rating: 4.5 out of 5,5257 reviews,43 total hours,485 lectures,All Levels,Elshad Karimov
56,Master Python programming by solving scientific projects,Learn practical coding in <strong>Python</strong> from a warm-blooded scientist. Each video includes hands-on solved practice problems!,Rating: 4.8 out of 5,894 reviews,37 total hours,171 lectures,Beginner,Mike X Cohen
57,Python for Beginners: Learn Python Programming (Python 3),"Learn <strong>Python</strong> Programming the Easy Way, Complete with Examples, Quizzes, Exercises and more. Learn <strong>Python</strong> 2 and <strong>Python</strong> 3.",Rating: 4.5 out of 5,33797 reviews,3 total hours,78 lectures,All Levels,Jason Cannon
58,Python for Beginners,Learn Fastest Growing language,Rating: 4.5 out of 5,8065 reviews,11 total hours,78 lectures,Beginner,Navin Reddy
59,Python A-Z™: Python For Data Science With Real Exercises!,"Programming In <strong>Python</strong> For Data Analytics And Data Science. Learn Statistical Analysis, Data Mining And Visualization",Rating: 4.6 out of 5,25390 reviews,11 total hours,71 lectures,All Levels,"Kirill Eremenko, Ligency I Team, Ligency Team"
60,"Python 3: Deep Dive (Part 2 - Iteration, Generators)","Sequences, Iterables, Iterators, Generators, Context Managers and Generator-based Coroutines",Rating: 4.9 out of 5,2079 reviews,36 total hours,142 lectures,Intermediate,Fred Baptiste
61,Complete Machine Learning & Data Science Bootcamp 2023,"Learn Data Science, Data Analysis, Machine Learning (Artificial Intelligence) and <strong>Python</strong> with Tensorflow, Pandas & more!",Rating: 4.6 out of 5,13859 reviews,44 total hours,378 lectures,All Levels,"Andrei Neagoie, Daniel Bourke, Zero To Mastery"
62,Learn Pro Advanced Python Programming,Become a Professional <strong>Python</strong> Programmer by learning Advance Level Programming & using them to make real  Applications,Rating: 4.5 out of 5,506 reviews,26.5 total hours,174 lectures,Expert,Data Scientist
63,The Data Analyst Course: Complete Data Analyst Bootcamp 2023,"Complete Data Analyst Training: <strong>Python</strong>, NumPy, Pandas, Data Collection, Preprocessing, Data Types, Data Visualization",Rating: 4.5 out of 5,6463 reviews,21 total hours,274 lectures,All Levels,365 Careers
64,Python Django - The Practical Guide,Learn how to build web applications and websites with <strong>Python</strong> and the Django framework,Rating: 4.7 out of 5,3936 reviews,23 total hours,256 lectures,Beginner,"Academind by Maximilian Schwarzmüller, Maximilian Schwarzmüller"
65,Web Developer Bootcamp with Flask and Python in 2022,"Become a Full Stack Web Developer using Flask, Python, HTML, CSS, and MongoDB! Fully updated for 2022 and beyond.",Rating: 4.6 out of 5,5923 reviews,20 total hours,186 lectures,Intermediate,"Jose Salvatierra, Teclado by Jose Salvatierra"
66,The Complete Python & PostgreSQL Developer Course,Build 9 projects—master two essential and modern technologies in Python and PostgreSQL,Rating: 4.6 out of 5,4882 reviews,22 total hours,186 lectures,Beginner,"Rob Percival, Jose Salvatierra, Codestars • over 2 million students worldwide!, Teclado by Jose Salvatierra"
67,REST APIs with Flask and Python in 2022,"Build professional REST APIs with Python, Flask, Docker, Flask-Smorest, and Flask-SQLAlchemy",Rating: 4.6 out of 5,19244 reviews,12 total hours,123 lectures,Intermediate,"Jose Salvatierra, Teclado by Jose Salvatierra"
68,Complete Python Programming Masterclass Beginner to Advanced,Learn to Program like a Pro with <strong>Python</strong>. Start with <strong>Python</strong> Programming Basics and progress to a <strong>Python</strong> Professional.,Rating: 4.5 out of 5,7587 reviews,7 total hours,109 lectures,All Levels,"Kyle Pew, Office Newb"
69,Python for beginners - Learn all the basics of python,Learn how to program in <strong>python</strong>- <strong>python</strong> functions-<strong>python</strong> basic apps - <strong>python</strong> tips and tricks -  Other <strong>Python</strong> features,Rating: 4.4 out of 5,8356 reviews,5 total hours,31 lectures,Beginner,Yassin Marco
70,Selenium Webdriver with PYTHON from Scratch + Frameworks,Version 4 LATEST - Learn <strong>Python</strong> Programming & Selenium <strong>Python</strong> Automation from Basics to Advanced level + 5 LIVE Project,Rating: 4.6 out of 5,12629 reviews,17 total hours,121 lectures,All Levels,Rahul Shetty
71,Python All In-One 2023 ™️ -Everything You'll Ever Need,,Rating: 4.7 out of 5,67 reviews,30.5 total hours,466 lectures,All Levels,Mouhammad Hamsho
72,Complete Python Bootcamp From Zero to Hero in Python 2023,,Rating: 0.0 out of 5,0 reviews,5 total hours,41 lectures,All Levels,Walid Hikal
73,Python Course From Zero | Python For All (Updated 2022),,Rating: 5.0 out of 5,6 reviews,7 total hours,49 lectures,All Levels,Mozn Akhourshiedah
74,Python For Absolute Beginners-Learn Python From Scratch 2022,,Rating: 5.0 out of 5,1 review,2 total hours,58 lectures,Beginner,Afridi Biswas
75,Python Weekend Bootcamp,,Rating: 0.0 out of 5,0 reviews,5 total hours,59 lectures,All Levels,Jeet Vora
76,Unlock the Power of Python: Master the Basics and Beyond!,,Rating: 5.0 out of 5,21 reviews,6.5 total hours,51 lectures,Beginner,Mosh Trials
77,Python 3: Fundamentals,,Rating: 5.0 out of 5,28 reviews,47.5 total hours,284 lectures,Beginner,Fred Baptiste
78,Master Python by Building Real World Python Projects,,Rating: 0.0 out of 5,0 reviews,2 total hours,18 lectures,All Levels,Vision Education
79,Python Programming Bootcamp,A Complete <strong>Python</strong> Course Focused on Problem Solving that will Expand into All <strong>Python</strong> Can Do,Rating: 4.7 out of 5,2307 reviews,57.5 total hours,219 lectures,All Levels,Derek Banas
80,Learn Advanced Level Programming in Python,Make Advanced Level Applications using Advanced Level Concepts of <strong>Python</strong>,Rating: 5.0 out of 5,90 reviews,22 total hours,79 lectures,Expert,Team Python
81,Practical Python: Learn Python Basics Step by Step- Python 3,Get started quickly with <strong>Python</strong> (<strong>Python</strong> 3): Only Hands-on Lessons and Practice to Master <strong>Python</strong> basics.,Rating: 4.8 out of 5,63 reviews,4 total hours,54 lectures,Beginner,Edouard Renard
82,Interactive Python Dashboards with Plotly and Dash,"Learn how to create interactive plots and intelligent dashboards with Plotly, <strong>Python</strong>, and the Dash library!",Rating: 4.7 out of 5,8007 reviews,9.5 total hours,69 lectures,Intermediate,Jose Portilla
83,The Complete Python Masterclass : Become a Python Engineer,"<strong>Python</strong> For All : Basics, Intermediate and Advance Level Concepts + Learn to make Games and Real Time Applications",Rating: 4.9 out of 5,291 reviews,41.5 total hours,271 lectures,All Levels,Khan School
84,Python for Programmers,Learn the core of <strong>Python</strong> quickly with this course tailored to programmers,Rating: 4.5 out of 5,3059 reviews,6 total hours,84 lectures,All Levels,Nick Walter
85,NLP - Natural Language Processing with Python,"Learn to use Machine Learning, Spacy, NLTK, SciKit-Learn, Deep Learning, and more to conduct Natural Language Processing",Rating: 4.6 out of 5,12655 reviews,11.5 total hours,80 lectures,Intermediate,Jose Portilla
86,Python for Absolute Beginners | Python Beginner to Pro 2023,Beginner friendly <strong>Python</strong>! Become a fluent <strong>Python</strong> programmer Learn the <strong>Python</strong> basics then build inspiring <strong>Python</strong> projects,Rating: 4.6 out of 5,4736 reviews,14 total hours,177 lectures,All Levels,"365 Careers, Giles McMullen-Klein"
87,Python Programming MADE EASY :Python Programming in Python 3,Beginners <strong>Python</strong> Coding. Data Science <strong>Python</strong> Coding. Data Analysis <strong>Python</strong>. Web <strong>Python</strong>. AI <strong>Python</strong>. Data Analytics <strong>Python</strong>.,Rating: 4.7 out of 5,6012 reviews,2 total hours,20 lectures,Beginner,Cher Hin Chong
88,Python Programming For Beginners: Learn Python In 9 Days,<strong>Python</strong> fundamentals taught thoroughly and at a gentle pace accessible for everyone,Rating: 4.7 out of 5,145 reviews,11.5 total hours,88 lectures,Beginner,Jonathan Martin
89,"Python 3: Deep Dive (Part 3 - Hash Maps, JSON Serialization)","Dictionaries, Sets, and Related Data Structures",Rating: 4.9 out of 5,1258 reviews,22 total hours,85 lectures,Intermediate,Fred Baptiste
90,Azure Databricks & Spark Core For Data Engineers(Python/SQL),"Real World Project on Formula1 Racing for Data Engineers using Azure Databricks, Delta Lake, Azure Data Factory [DP203]",Rating: 4.6 out of 5,6528 reviews,16 total hours,152 lectures,All Levels,Ramesh Retnasamy
91,Basics of Python in 2 Hours,Learn the ABCs of <strong>Python</strong> 3 programming with plenty of quizzes / projects and exercises. Master the <strong>Python</strong> basic concepts,Rating: 4.7 out of 5,165 reviews,4 total hours,27 lectures,Beginner,Bihan Mahadewa
92,2022 Python Data Analysis & Visualization Masterclass,"Pandas, Matplotlib, Seaborn, & More! Analyze Dozens of Datasets & Create Stunning Visualizations",Rating: 4.7 out of 5,1095 reviews,20.5 total hours,202 lectures,Beginner,Colt Steele
93,Python Certification Exam PCEP-30-02 - Preparation,Get certified for <strong>Python</strong> in 2023! Prepare for your <strong>Python</strong> Certification Exam PCEP-30-02 with 6 Practice Tests,Rating: 4.6 out of 5,310 reviews,390 questions,,Beginner,Cord Mählmann
94,"Python + SQL + Tableau: Integrating Python, SQL, and Tableau","See the full picture: Learn how to combine the three most important tools in data science: <strong>Python</strong>, SQL, and Tableau",Rating: 4.5 out of 5,4284 reviews,5.5 total hours,91 lectures,Intermediate,365 Careers
95,Python for Absolute Beginners: Learn Python in a Week!,A <strong>Python</strong> 3 Practical Programming Course for Absolute Beginners - Learn how to Code in <strong>Python</strong> 3.9 (2021 Edition),Rating: 4.7 out of 5,1305 reviews,8.5 total hours,119 lectures,Beginner,Andreas Exadaktylos
96,Web Developer Bootcamp with Flask and Python in 2022,"Become a Full Stack Web Developer using Flask, Python, HTML, CSS, and MongoDB! Fully updated for 2022 and beyond.",Rating: 4.6 out of 5,5923 reviews,20 total hours,186 lectures,Intermediate,"Jose Salvatierra, Teclado by Jose Salvatierra"
97,The Complete Python & PostgreSQL Developer Course,Build 9 projects—master two essential and modern technologies in Python and PostgreSQL,Rating: 4.6 out of 5,4882 reviews,22 total hours,186 lectures,Beginner,"Rob Percival, Jose Salvatierra, Codestars • over 2 million students worldwide!, Teclado by Jose Salvatierra"
98,REST APIs with Flask and Python in 2022,"Build professional REST APIs with Python, Flask, Docker, Flask-Smorest, and Flask-SQLAlchemy",Rating: 4.6 out of 5,19244 reviews,12 total hours,123 lectures,Intermediate,"Jose Salvatierra, Teclado by Jose Salvatierra"
99,"Python Hands-On 46 Hours, 210 Exercises, 5 Projects, 2 Exams","Learn <strong>Python</strong> programming from Beginner to Expert level with Projects, Coding Exercises, Quizzes, Assignments and Exams.",Rating: 4.5 out of 5,512 reviews,45.5 total hours,265 lectures,All Levels,Musa Arda
100,Practice Python with 100 Python Exercises,Learn <strong>Python</strong> the hard way by solving <strong>Python</strong> problems ranging from easy to advanced! Solve 100 exercises in <strong>Python</strong> 3!,Rating: 4.3 out of 5,3002 reviews,3 total hours,208 lectures,All Levels,Ardit Sulce
101,Mastering 4 critical SKILLS using Python,190 problems to enhance problem-solving skills. 5 projects for Project Building and Design Skills. High-quality quizzes,Rating: 4.8 out of 5,799 reviews,28.5 total hours,361 lectures,All Levels,"Dr. Moustafa Saad Ibrahim, CSGetSkilled Academy"
102,Python All In-One 2023 ™️ -Everything You'll Ever Need,,Rating: 4.7 out of 5,67 reviews,30.5 total hours,466 lectures,All Levels,Mouhammad Hamsho
103,Complete Python Bootcamp From Zero to Hero in Python 2023,,Rating: 0.0 out of 5,0 reviews,5 total hours,41 lectures,All Levels,Walid Hikal
104,Python Course From Zero | Python For All (Updated 2022),,Rating: 5.0 out of 5,6 reviews,7 total hours,49 lectures,All Levels,Mozn Akhourshiedah
105,Python For Absolute Beginners-Learn Python From Scratch 2022,,Rating: 5.0 out of 5,1 review,2 total hours,58 lectures,Beginner,Afridi Biswas
106,Python Weekend Bootcamp,,Rating: 0.0 out of 5,0 reviews,5 total hours,59 lectures,All Levels,Jeet Vora
